NCT Number,Study Title,Study URL,Study Status,Study Results,Conditions,Interventions,Sponsor,Collaborators,Sex,Age,Enrollment,Funder Type,Study Type,Study Design,Start Date,Completion Date,Locations
NCT01580358,"Therapeutic Effects of Traditional Chinese Medicine, Shen-Mai San in Cancer Patient Undergoing Chemotherapy or Radiotherapy",https://clinicaltrials.gov/study/NCT01580358,UNKNOWN,NO,Cancer Patients Undergoing Chemotherapy or Radiotherapy,DRUG: Shen-Mai San|DRUG: Starch,Changhua Christian Hospital,Committee on Chinese Medicine and Pharmacy,ALL,"ADULT, OLDER_ADULT",60,OTHER,INTERVENTIONAL,"Allocation: RANDOMIZED|Intervention Model: PARALLEL|Masking: QUADRUPLE (PARTICIPANT, CARE_PROVIDER, INVESTIGATOR, OUTCOMES_ASSESSOR)|Primary Purpose: SUPPORTIVE_CARE",2009-10,2012-09,"Changhua Christian Hospital, Changhua, Taiwan"
NCT03793634,Evaluation of Topical Chamomile Versus Topical Triamcinolone Acetonide in Management of Oral Lichen Planus,https://clinicaltrials.gov/study/NCT03793634,UNKNOWN,NO,Oral Lichen Planus,DRUG: topical chamomile,Cairo University,,ALL,"ADULT, OLDER_ADULT",37,OTHER,INTERVENTIONAL,Allocation: RANDOMIZED|Intervention Model: PARALLEL|Masking: SINGLE (OUTCOMES_ASSESSOR)|Primary Purpose: TREATMENT,2019-01-15,2020-03-01,
NCT00856167,Traditional Chinese Medicine (TCM) for Temporomandibular Dysfunction (TMD): A Whole Systems Multi-site Trial,https://clinicaltrials.gov/study/NCT00856167,COMPLETED,NO,Temporomandibular Dysfunction,DRUG: TCM|BEHAVIORAL: Self-care for TMD,University of Arizona,National Center for Complementary and Integrative Health (NCCIH),ALL,"ADULT, OLDER_ADULT",160,OTHER,INTERVENTIONAL,Allocation: RANDOMIZED|Intervention Model: PARALLEL|Masking: NONE|Primary Purpose: TREATMENT,2006-09,2010-12,
NCT06452966,The Impact and Effect of Traditional Chinese Medicine Treatment on Organ Failure in Critically Ill Patients,https://clinicaltrials.gov/study/NCT06452966,RECRUITING,NO,"Organ Failure, Multiple|Indigestion|Delayed Gastric Emptying|Respiratory Failure|Morality",OTHER: traditional Chinese medicine|OTHER: Routine ICU care|OTHER: historical Routine ICU care,China Medical University Hospital,,ALL,"ADULT, OLDER_ADULT",350,OTHER,INTERVENTIONAL,Allocation: NON_RANDOMIZED|Intervention Model: PARALLEL|Masking: NONE|Primary Purpose: TREATMENT,2024-05-07,2027-05-30,"China Medical University Hospital, Taichung, 403, Taiwan"
NCT01898091,Herbal Mouthrinse for Oral Mucositis Study,https://clinicaltrials.gov/study/NCT01898091,COMPLETED,YES,Oral Mucositis,DRUG: Neem Mouthrinse|DRUG: Placebo Mouthrinse,Medical University of South Carolina,National Cancer Institute (NCI),ALL,"ADULT, OLDER_ADULT",50,OTHER,INTERVENTIONAL,"Allocation: RANDOMIZED|Intervention Model: PARALLEL|Masking: QUADRUPLE (PARTICIPANT, CARE_PROVIDER, INVESTIGATOR, OUTCOMES_ASSESSOR)|Primary Purpose: SUPPORTIVE_CARE",2013-07,2015-06,"Medical University of South Carolina, Charleston, South Carolina, 29425-9170, United States"
NCT04747041,Evaluation of a Phyto Aromatherapy Treatment in the Management of Recurrent Cystitis,https://clinicaltrials.gov/study/NCT04747041,ACTIVE_NOT_RECRUITING,NO,Cystitis Recurrent,COMBINATION_PRODUCT: CYSCONTROL/PHYTOCYST Herbal tea,Centre Hospitalier Universitaire de Nice,,FEMALE,"ADULT, OLDER_ADULT",15,OTHER,INTERVENTIONAL,Allocation: NA|Intervention Model: SINGLE_GROUP|Masking: NONE|Primary Purpose: TREATMENT,2021-05-18,2024-12-01,"Hôpital Archet, Nice, 06202, France"
NCT02653937,The Effect of Shigyakusan Used for IBS and MUPS Diagnosed by Abdominal N Line Tenderness,https://clinicaltrials.gov/study/NCT02653937,COMPLETED,NO,Irritable Bowel Syndrome,DRUG: Tsumura's shigyakusan,Nakatani Clinic,Wakayama Medical University,ALL,"CHILD, ADULT, OLDER_ADULT",1,OTHER,INTERVENTIONAL,Allocation: NA|Intervention Model: SINGLE_GROUP|Masking: NONE|Primary Purpose: TREATMENT,2013-03,2015-03,
NCT00786500,Anti-diabetic Effect of Gynostemma Pentaphyllum Tea in Type 2 Diabetic Patients,https://clinicaltrials.gov/study/NCT00786500,COMPLETED,NO,Type 2 Diabetes,DIETARY_SUPPLEMENT: Gynostemma pentaphyllum tea|DIETARY_SUPPLEMENT: Placebo tea,Hanoi Medical University,Karolinska Institutet|Swedish International Development Cooperation Agency (SIDA),ALL,"ADULT, OLDER_ADULT",24,OTHER,INTERVENTIONAL,"Allocation: RANDOMIZED|Intervention Model: PARALLEL|Masking: DOUBLE (PARTICIPANT, INVESTIGATOR)|Primary Purpose: TREATMENT",2007-02,2007-12,"National Institute of Gerontology, HMU, Hanoi, Vietnam"
NCT05601180,"Evaluation of the Efficacy of Respicure® (Resveratrol / Quercetin) in the Management of Respiratory Conditions Including Asthma,COPD and Long COVID.",https://clinicaltrials.gov/study/NCT05601180,COMPLETED,NO,Asthma|Chronic Obstructive Pulmonary Disease|Long COVID,OTHER: Respicure®|OTHER: Standard of care,Beker Laboratories,,ALL,"ADULT, OLDER_ADULT",402,INDUSTRY,INTERVENTIONAL,Allocation: RANDOMIZED|Intervention Model: PARALLEL|Masking: NONE|Primary Purpose: SUPPORTIVE_CARE,2022-10-27,2024-01-15,"CHU Beni Messous/Pneumologie A, Algiers, Algeria|CHU Beni Messous/Pneumologie B, Algiers, Algeria|CHU Annaba/Pneumo-phtisiologie, Annaba, Algeria|EPH Batna/Pneumo-phtisiologie, Batna, Algeria|CHU Constantine/Pneumo-phtisiologie, Constantine, Algeria|EPH Laghouat/Pneumo-phtisiologie, Laghouat, Algeria|CHU Oran/Pneumo-phtisiologie B, Oran, Algeria|CHU Sidi Bel Abbes/Pneumo-phtisiologie, Sidi Bel Abbès, Algeria"
NCT01745302,Efficacy Study of Chinese Medicine Plus EGFR-TKI Versus EGFR-TKI in Advanced Pulmonary Adenocarcinoma,https://clinicaltrials.gov/study/NCT01745302,UNKNOWN,NO,Cancer,DRUG: TCM|DRUG: EGFR-TKI,Shanghai University of Traditional Chinese Medicine,Shanghai Chest Hospital,ALL,"ADULT, OLDER_ADULT",470,OTHER,OBSERVATIONAL,Observational Model: |Time Perspective: p,2011-11,2016-12,
NCT03038035,The Alzheimer's Disease THErapy With NEuroaid (ATHENE) Study,https://clinicaltrials.gov/study/NCT03038035,UNKNOWN,NO,Alzheimer Disease,DRUG: MLC901|DRUG: Placebo,"National University Hospital, Singapore",,ALL,"ADULT, OLDER_ADULT",150,OTHER,INTERVENTIONAL,"Allocation: RANDOMIZED|Intervention Model: PARALLEL|Masking: QUADRUPLE (PARTICIPANT, CARE_PROVIDER, INVESTIGATOR, OUTCOMES_ASSESSOR)|Primary Purpose: TREATMENT",2016-12,2019-06,"National University Hospital, Sg, 119074, Singapore"
NCT02233439,"Double-blind, Placebocontrolled A Randomized Trial on the Efficacy of Herbal Galactogogues",https://clinicaltrials.gov/study/NCT02233439,UNKNOWN,NO,Breastfeeding,DIETARY_SUPPLEMENT: Herbal galactagogue|DIETARY_SUPPLEMENT: Placebo,Università degli Studi dell'Insubria,Milte Italia SpA,FEMALE,"ADULT, OLDER_ADULT",210,OTHER,INTERVENTIONAL,"Allocation: RANDOMIZED|Intervention Model: PARALLEL|Masking: TRIPLE (PARTICIPANT, CARE_PROVIDER, OUTCOMES_ASSESSOR)|Primary Purpose: TREATMENT",2014-09,2015-03,"Azienda Ospedaliero-Universitaria Ospedale di Circolo e Fondazione Macchi, Presidio F. Del Ponte, Varese, 21100, Italy"
NCT02027467,Study to Assess the Effect of StemAlive® Supplement on the Levels of Stem Cells in Human Volunteers,https://clinicaltrials.gov/study/NCT02027467,COMPLETED,NO,Healthy,DIETARY_SUPPLEMENT: StemAlive®|DIETARY_SUPPLEMENT: Placebo (For StemAlive®),Vedic Lifesciences Pvt. Ltd.,Stem Vida International,ALL,"ADULT, OLDER_ADULT",23,INDUSTRY,INTERVENTIONAL,"Allocation: RANDOMIZED|Intervention Model: PARALLEL|Masking: DOUBLE (PARTICIPANT, INVESTIGATOR)|Primary Purpose: ",2014-02,2014-04,"Dhanwantari Clinic, Mumbai, Maharashtra, 400072, India"
NCT06467851,Effect of Suanzaoren Decoction and Huanglian Wendan Decoction on Biorhythm of Insomnia Patients,https://clinicaltrials.gov/study/NCT06467851,COMPLETED,NO,Chronic Insomnia|Melatonin|Circadian Rhythm|Suanzaoren Decoction and Huanglian Wendan,DRUG: Suanzaoren Decoction and Huanglian Wenda Decoction,The First Affiliated Hospital with Nanjing Medical University,,ALL,ADULT,19,OTHER,INTERVENTIONAL,Allocation: NON_RANDOMIZED|Intervention Model: PARALLEL|Masking: NONE|Primary Purpose: TREATMENT,2023-08-31,2024-04-10,"The First Affiliated Hospital of Nanjing Medical University, Nanjing, Jiangsu, 210000, China|The First Affiliated Hospital of Nanjing Medical University, Nanjing, Jiangsu, 224000, China"
NCT06402760,Comprehensive Intervention of Diabetes and Psoriasis Comorbidity Prevention and Control,https://clinicaltrials.gov/study/NCT06402760,NOT_YET_RECRUITING,NO,Psoriasis|Diabetes,OTHER: TCM comprehensive treatment|DRUG: Western medicine,Shanghai Yueyang Integrated Medicine Hospital,Shanghai Hongkou District Center for Disease Control And Prevention,ALL,"ADULT, OLDER_ADULT",300,OTHER,INTERVENTIONAL,Allocation: NON_RANDOMIZED|Intervention Model: PARALLEL|Masking: NONE|Primary Purpose: PREVENTION,2024-07-01,2025-12-31,
NCT05645120,Impact of Nutrition Education on Knowledge and Beliefs About Dietary Supplements/Herbal Foods,https://clinicaltrials.gov/study/NCT05645120,COMPLETED,NO,"Knowledge, Attitudes, Practice",OTHER: Education,Hacettepe University,,ALL,"ADULT, OLDER_ADULT",226,OTHER,INTERVENTIONAL,Allocation: NON_RANDOMIZED|Intervention Model: PARALLEL|Masking: NONE|Primary Purpose: HEALTH_SERVICES_RESEARCH,2021-06-01,2022-03-01,"Hacettepe University, Ankara, 06100, Turkey"
NCT03571503,The Effectiveness of Doin (Conduction Exercise) of the Pelvic Joint for HLD With Radiating Leg Pain,https://clinicaltrials.gov/study/NCT03571503,COMPLETED,NO,Intervertebral Disc Displacement|Sciatica|Sciatic Radiculopathy,PROCEDURE: Doin (conduction exercise)|DRUG: Herbal medicine|PROCEDURE: Chuna manual therapy|PROCEDURE: Bee venom pharmacopuncture|PROCEDURE: Pharmacopuncture|PROCEDURE: Acupuncture|PROCEDURE: Electroacupuncture|PROCEDURE: Cupping|OTHER: Other intervention(s),Jaseng Medical Foundation,,ALL,"ADULT, OLDER_ADULT",40,OTHER,OBSERVATIONAL,Observational Model: |Time Perspective: p,2018-07-09,2019-09-20,"Daejeon Jaseng Hospital of Korean Medicine, Daejeon, 35262, Korea, Republic of"
NCT02334969,Curative Efficacy of Secondary Prevention for Patients With Ischemic Stroke Through Syndrome Differentiation of TCM,https://clinicaltrials.gov/study/NCT02334969,COMPLETED,NO,Ischemic Stroke,DRUG: Naoxintong Capsule|DRUG: Placebo,Xiaofei Yu,Shanghai Municipal Science and Technology Commission,ALL,"ADULT, OLDER_ADULT",2200,OTHER,INTERVENTIONAL,"Allocation: RANDOMIZED|Intervention Model: PARALLEL|Masking: DOUBLE (INVESTIGATOR, OUTCOMES_ASSESSOR)|Primary Purpose: PREVENTION",2016-04,2018-08-30,"Shanghai seventh People's Hospital, Shanghai, Shanghai, 200000, China|Shanghai Ninth People's Hospital affliated to Shanghai Jiao Tong University Shool of Medcine, Shanghai, Shanghai, 200011, China|North Branch of Ruijin Hospital affliated to Shanghai Jiao Tong University, Shanghai, Shanghai, 200020, China|Shanghai Putuo Central Hospital, Shanghai, Shanghai, 200021, China|Shuguang Hospital affliated to Shanghai University of Traditional Chinese Medicine, Shanghai, Shanghai, 200021, China|Longhua Hospital affliated to Shanghai University of Traditional Chinese Medicine, Shanghai, Shanghai, 200032, China|Zhongshan Hospital affliated to Fudan University, Shanghai, Shanghai, 200032, China|Huashan Hospital affliated to Fudan University, Shanghai, Shanghai, 200040, China|Shanghai fifth People's Hospital affliated to Fudan University, Shanghai, Shanghai, 200040, China|Tongren Hospital affliated to Shanghai Jiao Tong University, Shanghai, Shanghai, 200050, China|Tongji Hospital, Shanghai, Shanghai, 200065, China|Shanghai Chinese Medicine Hospital, Shanghai, Shanghai, 200071, China|Shanghai tenth People's Hospital, Shanghai, Shanghai, 200072, China|Shanghai Hospital of Integrative Medicine, Shanghai, Shanghai, 200082, China|Xinhua Hospital affliated to Shanghai Jiao Tong University Shool of Medcine, Shanghai, Shanghai, 200092, China|Dongfang Hospital affliated to Tongji University, Shanghai, Shanghai, 200120, China|Pudong Gong Li Hospital of Shanghai, Shanghai, Shanghai, 200135, China|Shanghai sixth People's Hospital affliated to Shanghai Jiao Tong University, Shanghai, Shanghai, 200233, China|Changning Tongren Hospital of Shanghai, Shanghai, Shanghai, 200336, China|Changhai Hospital, Shanghai, Shanghai, 200433, China|Pudong Hospital of Traditional Chinese Medicine, Shanghai, Shanghai, 201200, China|East Branch of Shanghai sixth People's Hospital, Shanghai, Shanghai, 201306, China|Qingpu Branch of Zhongshan Hospital affliated to Fudan University, Shanghai, Shanghai, 201700, China|Shanghai third People's Hospital affliated to Shanghai Jiao Tong University, Shanghai, Shanghai, 201999, China"
NCT00522093,Efficacy and Safety of TJ-100 in the Treatment of Chronic Constipation,https://clinicaltrials.gov/study/NCT00522093,COMPLETED,NO,Chronic Constipation,DRUG: TJ-100,Showa Inan General Hospital,Tsumura USA,ALL,"ADULT, OLDER_ADULT",60,OTHER,INTERVENTIONAL,Allocation: NON_RANDOMIZED|Intervention Model: SINGLE_GROUP|Masking: NONE|Primary Purpose: TREATMENT,2007-08,2008-03,"Showa Inan General Hospital, Komagane, 399-4191, Japan"
NCT03053882,Efficacy of Peppermint and Green Tea in Malodor,https://clinicaltrials.gov/study/NCT03053882,COMPLETED,NO,Bad Breath,OTHER: mouthwash,Shahid Beheshti University of Medical Sciences,,ALL,ADULT,88,OTHER,INTERVENTIONAL,"Allocation: RANDOMIZED|Intervention Model: CROSSOVER|Masking: DOUBLE (INVESTIGATOR, OUTCOMES_ASSESSOR)|Primary Purpose: SUPPORTIVE_CARE",2015-01,2016-06,
NCT02330029,Pinaverium and Herbs for Irritable Bowel Syndrome Treatment: an Onset and Offset Study (PHIBEST),https://clinicaltrials.gov/study/NCT02330029,UNKNOWN,NO,Irritable Bowel Syndrome,DRUG: Pinaverium|DEVICE: Atractylodes|DEVICE: Paeonia Lactiflora|DEVICE: Tangerine Peel|DRUG: Ledebouriella Root|DRUG: Radix codonopsitis|DRUG: Radix curcumae|DRUG: Fingered citron|DRUG: Tuckahoe|DRUG: Placebo,Macrohard Institute of Health,,ALL,"ADULT, OLDER_ADULT",800,OTHER,INTERVENTIONAL,"Allocation: RANDOMIZED|Intervention Model: PARALLEL|Masking: DOUBLE (PARTICIPANT, INVESTIGATOR)|Primary Purpose: TREATMENT",2012-08,2017-05,"Second Jiangsu Provincial Hospital of Traditional Chinese Medicine affiliated to Nanjing University of Traditional Chinese Medicine, Nanjing, Jiangsu, 210017, China|Jiangsu Provincial Hospital of Traditional Chinese Medicine affiliated to Nanjing University of Traditional Chinese Medicine, Nanjing, Jiangsu, 210029, China|Beijing Xuanwu Hospital of Traditional Chinese Medicine affiliated to Capital Medical University., Beijing, 100050, China|Shanghai First People's Hospital affiliated to Shanghai Tiao Tong University, Shanghai, 200240, China"
NCT03597620,Evaluating the Efficacy and Tolerability of Application of Metaderm Product for the Treatment of Psoriasis,https://clinicaltrials.gov/study/NCT03597620,COMPLETED,YES,Psoriasis,DRUG: Metaderm,University of Alabama at Birmingham,,ALL,"ADULT, OLDER_ADULT",11,OTHER,INTERVENTIONAL,Allocation: NON_RANDOMIZED|Intervention Model: PARALLEL|Masking: NONE|Primary Purpose: TREATMENT,2018-11-07,2022-12-13,"Dermatology at the Whitaker Clinic, Birmingham, Alabama, 35249, United States"
NCT04674709,Evaluation of the Safety and Pharmacokinetics of Oleander 4X in Healthy Volunteers,https://clinicaltrials.gov/study/NCT04674709,UNKNOWN,NO,Flu-like Symptoms,DRUG: Oleander 4X - single|DRUG: Oleander 4X - double|DRUG: Oleander 4X - quadruple|DRUG: Placebo,Avila Herbals,,ALL,"ADULT, OLDER_ADULT",75,INDUSTRY,INTERVENTIONAL,"Allocation: RANDOMIZED|Intervention Model: PARALLEL|Masking: TRIPLE (PARTICIPANT, CARE_PROVIDER, INVESTIGATOR)|Primary Purpose: TREATMENT",2020-11-24,2021-01-15,"Dr. William Ball offices, Roanoke, Virginia, 24017, United States"
NCT04228757,A Clinical Study Assessing Efficacy of an Herbal Blend on Menopausal Symptoms and Quality of Life,https://clinicaltrials.gov/study/NCT04228757,UNKNOWN,NO,Menopause,DIETARY_SUPPLEMENT: phytoestrogen herbal blend|OTHER: Placebo,"i-Health, Inc.",ObvioHealth,FEMALE,"ADULT, OLDER_ADULT",130,INDUSTRY,INTERVENTIONAL,"Allocation: RANDOMIZED|Intervention Model: PARALLEL|Masking: TRIPLE (PARTICIPANT, CARE_PROVIDER, INVESTIGATOR)|Primary Purpose: TREATMENT",2019-06-28,2020-04-04,"ObvioHealth, Orlando, Florida, 32817, United States"
NCT04940520,Alpha-bisabolol for Onychomycosis Treatment,https://clinicaltrials.gov/study/NCT04940520,COMPLETED,NO,Onychomycosis,BIOLOGICAL: Drug recommended by the Brazilian Society of Dermatology|COMBINATION_PRODUCT: Alpha bisabolol product and laser|BIOLOGICAL: Alpha bisabolol product,Universidade do Vale do Sapucai,,ALL,"ADULT, OLDER_ADULT",60,OTHER,INTERVENTIONAL,Allocation: RANDOMIZED|Intervention Model: PARALLEL|Masking: SINGLE (OUTCOMES_ASSESSOR)|Primary Purpose: TREATMENT,2020-06-01,2021-05-01,"Vale do Sapucaí University, Pouso Alegre, Minas Gerais, 37550-000, Brazil"
NCT04949932,Application of Poly-herbal Powder for Treating Acne Vulgaris,https://clinicaltrials.gov/study/NCT04949932,COMPLETED,NO,Acne Vulgaris,"OTHER: Mixed powder of Lens culinaris, Curcuma longa, Mentha arvensis, Azadirachta indica, and Trigonella foenumgraecum.|OTHER: Cicer arietinum powder",Dr. Md. Shahab Uddin,,ALL,ADULT,42,OTHER,INTERVENTIONAL,"Allocation: RANDOMIZED|Intervention Model: PARALLEL|Masking: DOUBLE (PARTICIPANT, INVESTIGATOR)|Primary Purpose: TREATMENT",2021-04-03,2021-05-12,"Hamdard University Bangladesh, Munshiganj, 1510, Bangladesh"
NCT04446390,Preventive Regimens With Herbal and Fluoride Toothpaste on Remineralization in High Caries Patients With Initial Lesions,https://clinicaltrials.gov/study/NCT04446390,UNKNOWN,NO,Dental Caries,OTHER: Himalaya complete care toothpaste|OTHER: colgate cavity protection,Cairo University,,ALL,"CHILD, ADULT",32,OTHER,INTERVENTIONAL,"Allocation: RANDOMIZED|Intervention Model: PARALLEL|Masking: QUADRUPLE (PARTICIPANT, CARE_PROVIDER, INVESTIGATOR, OUTCOMES_ASSESSOR)|Primary Purpose: PREVENTION",2021-01-01,2022-03-01,"Cairo University, Faculty of Oral and Dental Medicine, Cairo, Egypt|Cairo University, Cairo, Egypt"
NCT04537819,Study of Imupret Application in the Technology of Delayed Prescription of Antibiotics in Patients With Acute Tonsillitis,https://clinicaltrials.gov/study/NCT04537819,COMPLETED,NO,Acute Tonsillitis,DRUG: Imupret in addition to local NAID|DRUG: Local NAID (Benzydamin),Ivano-Frankivsk National Medical University,Bionorica SE,ALL,"CHILD, ADULT",200,OTHER,INTERVENTIONAL,Allocation: RANDOMIZED|Intervention Model: PARALLEL|Masking: NONE|Primary Purpose: TREATMENT,2019-03-20,2020-03-25,"Ivano-Frankivsk National Medical University, Ivano-Frankivs'k, Ivano-Frankivsk, Ukraine"
NCT02638051,Local mEHT + TCM Versus Intraperitoneal Chemoinfusion in Treatment of Malignant Ascites: Phase II RCT,https://clinicaltrials.gov/study/NCT02638051,COMPLETED,YES,Peritoneal Neoplasms|Ascites|Yang Deficiency|Yin Deficiency,DEVICE: Modulated Electro-Hyperthermia (mEHT)|DIETARY_SUPPLEMENT: TCM Herbal Decoction (Shi Pi)|DRUG: IPCI (CDDP+5FU),Galenic Research Institute Ltd,,ALL,"ADULT, OLDER_ADULT",260,OTHER,INTERVENTIONAL,Allocation: RANDOMIZED|Intervention Model: PARALLEL|Masking: NONE|Primary Purpose: TREATMENT,2014-01,2015-12,"Clifford Hospital, Guangzhou, Guangdong, 511495, China"
NCT03919942,Effect of Oxyflower® Gel as a Coadjuvant in Pericoronitis Treatment,https://clinicaltrials.gov/study/NCT03919942,COMPLETED,NO,Pericoronitis,OTHER: OxyFlower gel|OTHER: Chlorhexidine gel|OTHER: Placebo gel,Federal University of the Valleys of Jequitinhonha and Mucuri,,ALL,ADULT,51,OTHER,INTERVENTIONAL,"Allocation: RANDOMIZED|Intervention Model: PARALLEL|Masking: TRIPLE (PARTICIPANT, CARE_PROVIDER, INVESTIGATOR)|Primary Purpose: TREATMENT",2019-04-19,2019-12-01,"Universidade Federal dos Vales do Jequitinhonha e Mucuri, Diamantina, Minas Gerais, 39100000, Brazil"
NCT00100295,Herbal Treatment for Attention Deficit Hyperactivity Disorder (ADHD),https://clinicaltrials.gov/study/NCT00100295,COMPLETED,NO,Attention Deficit Hyperactivity Disorder,DRUG: Hypericum perforatum|OTHER: Placebo,National Center for Complementary and Integrative Health (NCCIH),,ALL,CHILD,59,NIH,INTERVENTIONAL,"Allocation: RANDOMIZED|Intervention Model: PARALLEL|Masking: TRIPLE (PARTICIPANT, INVESTIGATOR, OUTCOMES_ASSESSOR)|Primary Purpose: TREATMENT",2005-02,2006-11,"Bastyr University, Kenmore, Washington, 98028, United States"
NCT01800487,The Efficacy of Silymarin on the Prevention of Hepatotoxicity From Antituberculosis Drugs,https://clinicaltrials.gov/study/NCT01800487,COMPLETED,NO,Tuberculosis,DRUG: silymarin|DRUG: Placebo,Ramathibodi Hospital,,ALL,"ADULT, OLDER_ADULT",80,OTHER,INTERVENTIONAL,"Allocation: RANDOMIZED|Intervention Model: PARALLEL|Masking: QUADRUPLE (PARTICIPANT, CARE_PROVIDER, INVESTIGATOR, OUTCOMES_ASSESSOR)|Primary Purpose: PREVENTION",2012-01,2013-07,"Gastroenterology and Hepatology, Ramathibodi hospital, Bangkok, 10400, Thailand"
NCT00610519,Treatment of Acute Pharyngo-Tonsillitis With Essential Oils of Aromatic Plants,https://clinicaltrials.gov/study/NCT00610519,COMPLETED,NO,Viral Pharyngitis|Viral Tonsillitis,DIETARY_SUPPLEMENT: mixture of aromatic essential oils.|DIETARY_SUPPLEMENT: placebo,"HaEmek Medical Center, Israel",,ALL,"ADULT, OLDER_ADULT",33,OTHER,INTERVENTIONAL,"Allocation: RANDOMIZED|Intervention Model: PARALLEL|Masking: DOUBLE (PARTICIPANT, INVESTIGATOR)|Primary Purpose: TREATMENT",2008-01,2008-05,"Otorhinolaryngology department, Afula, 18101, Israel"
NCT06291883,Evaluation of KGR Prescriptions in Suppressing COVID-19 Infection.,https://clinicaltrials.gov/study/NCT06291883,COMPLETED,NO,Coronavirus Disease 2019|Severe Acute Respiratory Syndrome Coronavirus 2 Infection,COMBINATION_PRODUCT: Kang Guan Recipe (Treat)|COMBINATION_PRODUCT: Kang Guan Recipe (Placebo),Sheng-Teng Huang,,ALL,ADULT,26,OTHER,INTERVENTIONAL,Allocation: RANDOMIZED|Intervention Model: PARALLEL|Masking: SINGLE (PARTICIPANT)|Primary Purpose: BASIC_SCIENCE,2023-02-09,2024-02-08,"China Medical University Hospital, Taichung, North District, 404, Taiwan"
NCT00010725,Effects of Herbal Antioxidants on Cardiovascular Disease in Older Blacks,https://clinicaltrials.gov/study/NCT00010725,COMPLETED,NO,Cardiovascular Diseases,DRUG: MAK|DRUG: Vitamin Supplements,National Center for Complementary and Integrative Health (NCCIH),,ALL,"ADULT, OLDER_ADULT",138,NIH,INTERVENTIONAL,Allocation: RANDOMIZED|Intervention Model: |Masking: |Primary Purpose: TREATMENT,1999-09,2004-08,"Howard University Medical Center, Washington, Dc, District of Columbia, United States|Maharishi University of Management, Fairfield, Iowa, 52557, United States"
NCT06244550,Clinical Trials Using HepatoKeeper Herbal Essentials to Treat Non-alcoholic Fatty Liver Disease and Metabolic Factors,https://clinicaltrials.gov/study/NCT06244550,COMPLETED,NO,Non-alcoholic Fatty Liver Disease|Liver Fibrosis|Liver Injury,DRUG: Ganwei|DRUG: Metformin|DRUG: Placebo,Taipei City Hospital,"The One Biopharmaceutical Co., Ltd.",ALL,"ADULT, OLDER_ADULT",60,OTHER_GOV,INTERVENTIONAL,"Allocation: RANDOMIZED|Intervention Model: FACTORIAL|Masking: DOUBLE (PARTICIPANT, CARE_PROVIDER)|Primary Purpose: TREATMENT",2021-09-22,2023-06-13,"Taipei City Hospital, Taipei, 103212, Taiwan"
NCT03230071,Efficacy and Safety of TMBCZG in Mild to Moderate Vascular Dementia,https://clinicaltrials.gov/study/NCT03230071,COMPLETED,NO,Vascular Dementia,DRUG: TMBCZG|OTHER: placebo,"Dongzhimen Hospital, Beijing",Beijing Union pharmaceutical factory II|Beijing Compete Medical Technology Development Co. Ltd.,ALL,"ADULT, OLDER_ADULT",160,OTHER,INTERVENTIONAL,"Allocation: RANDOMIZED|Intervention Model: PARALLEL|Masking: QUADRUPLE (PARTICIPANT, CARE_PROVIDER, INVESTIGATOR, OUTCOMES_ASSESSOR)|Primary Purpose: TREATMENT",2017-07-28,2021-02-05,"Dongzhimen Hospital ,Beijing University of Chinese Medicine, Beijing, Beijing, 100700, China"
NCT00610779,Treatment of Acute Rhino-Sinusitis With Essential Oils of Aromatic Plants,https://clinicaltrials.gov/study/NCT00610779,COMPLETED,NO,Rhino-Sinusitis,DIETARY_SUPPLEMENT: mixture of aromatic essential oils.|DIETARY_SUPPLEMENT: placebo,"HaEmek Medical Center, Israel",,ALL,"ADULT, OLDER_ADULT",14,OTHER,INTERVENTIONAL,"Allocation: RANDOMIZED|Intervention Model: PARALLEL|Masking: DOUBLE (PARTICIPANT, INVESTIGATOR)|Primary Purpose: TREATMENT",2008-01,2008-05,"Otorhinolaryngology department, Afula, 18101, Israel"
NCT03447925,Treatment of Plantar Keratosis With Medicinal Plant in Diabetic Patients,https://clinicaltrials.gov/study/NCT03447925,COMPLETED,NO,Keratosis Plantaris,DRUG: Medicinal Plant|DRUG: Salicylate|DRUG: Vaseline,Universidade do Vale do Sapucai,,ALL,"ADULT, OLDER_ADULT",90,OTHER,INTERVENTIONAL,"Allocation: RANDOMIZED|Intervention Model: PARALLEL|Masking: DOUBLE (PARTICIPANT, INVESTIGATOR)|Primary Purpose: TREATMENT",2017-06-01,2020-01-01,"Beatriz B Martinez, Pouso Alegre, Minas Gerais, 37550312, Brazil"
NCT02777606,The Efficacy of Si-Ni-Tang (a Chinese Herbal Formula) for Severe Sepsis,https://clinicaltrials.gov/study/NCT02777606,COMPLETED,NO,Severe Sepsis,DRUG: Si-Ni-Tang,Guangdong Provincial Hospital of Traditional Chinese Medicine,,ALL,"ADULT, OLDER_ADULT",50,OTHER,INTERVENTIONAL,Allocation: RANDOMIZED|Intervention Model: PARALLEL|Masking: SINGLE (OUTCOMES_ASSESSOR)|Primary Purpose: TREATMENT,2016-06,2019-04,"Guangdong Provincial Hospital of Chinese Medicine, Guangzhou, Guangdong, 510145, China"
NCT05141864,Acmella Oleracea in the Analgesia of the Digital Rectal Examination,https://clinicaltrials.gov/study/NCT05141864,COMPLETED,NO,Analgesia in the Digital Rectal Examination,BIOLOGICAL: Acmella oleracea gel|DRUG: Lidocaine 2 % Topical Cream|OTHER: Ultrasound gel,Universidade do Vale do Sapucai,,MALE,"ADULT, OLDER_ADULT",150,OTHER,INTERVENTIONAL,"Allocation: RANDOMIZED|Intervention Model: PARALLEL|Masking: DOUBLE (PARTICIPANT, OUTCOMES_ASSESSOR)|Primary Purpose: OTHER",2021-03-05,2021-11-05,"Universidade do Vale do Sapucaí, Pouso Alegre, Minas Gerais, 37550-000, Brazil"
