NCT Number,Study Title,Study URL,Study Status,Study Results,Conditions,Interventions,Sponsor,Collaborators,Sex,Age,Enrollment,Funder Type,Study Type,Study Design,Start Date,Completion Date,Locations
NCT01224496,"Traditional Chinese Medicine in the Supportive Management of Anaemic and Cytopenic (Leukopenia, Thrombocytopenia) Haematological Disorders",https://clinicaltrials.gov/study/NCT01224496,COMPLETED,NO,Myelodysplastic Syndrome (MDS)|Aplastic Anaemia (AA)|Myelofibrosis (MF)|Thalassemia Intermedia,DRUG: Chinese herbal concoction twice a day for 6 months,Singapore General Hospital,Shanghai Yueyang Integrated Medicine Hospital|Singapore Bao Zhong Tang TCM Center,ALL,"CHILD, ADULT, OLDER_ADULT",38,OTHER,INTERVENTIONAL,Allocation: NA|Intervention Model: SINGLE_GROUP|Masking: NONE|Primary Purpose: SUPPORTIVE_CARE,2009-07,2011-08,"Singapore General Hospital, Singapore, 169608, Singapore"
NCT04855058,Long Term Follow-Up of Traumatic Fracture Patients Treated With Integrated Complementary and Alternative Medicine: Observational Study,https://clinicaltrials.gov/study/NCT04855058,COMPLETED,NO,"Fractures, Bone|Medicine, Korean Traditional",OTHER: online survey(or phone survey),Jaseng Medical Foundation,,ALL,"ADULT, OLDER_ADULT",665,OTHER,OBSERVATIONAL,Observational Model: |Time Perspective: p,2021-03-29,2021-12-31,"Jaseng Medical Foundation, Seoul-si, Korea, Republic of"
NCT01895816,Herbal Tonic Fertile Supplement(ZO2C5),https://clinicaltrials.gov/study/NCT01895816,COMPLETED,NO,Male Infertility,DIETARY_SUPPLEMENT: coated tablet,Arash Khaki,Islamic Azad University of Tabriz|Tabriz University,MALE,ADULT,1,OTHER,INTERVENTIONAL,Allocation: NA|Intervention Model: SINGLE_GROUP|Masking: SINGLE (CARE_PROVIDER)|Primary Purpose: SUPPORTIVE_CARE,2012-06,2012-06,"Womens Reproductive Health Research Center,Tabriz University Of Medical Sciences,Iran, Tabriz, Azarbyjan, 51388, Iran, Islamic Republic of"
NCT05398965,Eucalyptus Oil as Adjuvant Therapy for Coronavirus Disease 19 (COVID-19),https://clinicaltrials.gov/study/NCT05398965,COMPLETED,NO,COVID-19,DRUG: Eucalyptus Oil|DRUG: Standard COVID medication,Hasanuddin University,"Ministry of Agriculture, Republic of Indonesia",ALL,ADULT,54,OTHER,INTERVENTIONAL,Allocation: RANDOMIZED|Intervention Model: PARALLEL|Masking: NONE|Primary Purpose: TREATMENT,2020-11-18,2022-03-01,"Hasanuddin University Hospital, Makassar, South Sulawesi, 90245, Indonesia"
NCT02545036,Combined Western and Traditional Chinese Medicine Daycare for CKD Patients,https://clinicaltrials.gov/study/NCT02545036,COMPLETED,NO,Chronic Kidney Disease,OTHER: Traditional Chinese Medicine (TCM) daycare model,China Medical University Hospital,"Ministry of Health and Welfare, Taiwan",ALL,"ADULT, OLDER_ADULT",58,OTHER,INTERVENTIONAL,Allocation: NON_RANDOMIZED|Intervention Model: PARALLEL|Masking: NONE|Primary Purpose: TREATMENT,2015-06,2017-09-20,"China Medical University Hospital, Taichung, 404, Taiwan"
NCT03990935,Remineralization Potential of Ginger and Rosemary Herbals Versus Sodium Fluoride in Treatment of White Spot Lesions,https://clinicaltrials.gov/study/NCT03990935,UNKNOWN,NO,White Spot Lesions,OTHER: ginger and rosemary gel,Cairo University,,ALL,"CHILD, ADULT",60,OTHER,INTERVENTIONAL,Allocation: RANDOMIZED|Intervention Model: PARALLEL|Masking: SINGLE (OUTCOMES_ASSESSOR)|Primary Purpose: TREATMENT,2019-07,2020-06,"Cairo University, Cairo, Egypt"
NCT03147443,Evaluating the Effects of Traditional Chinese Medicine by N-of-1 Trials,https://clinicaltrials.gov/study/NCT03147443,UNKNOWN,NO,Bronchiectasis|Quality of Life|Traditional Chinese Medicine|Sputum|Symptoms|Individuality,DRUG: Individualized Decoction|DRUG: placebo|DRUG: Tested drug minus heat-clearing herbs,Shanghai University of Traditional Chinese Medicine,,ALL,"ADULT, OLDER_ADULT",36,OTHER,INTERVENTIONAL,"Allocation: RANDOMIZED|Intervention Model: CROSSOVER|Masking: TRIPLE (PARTICIPANT, CARE_PROVIDER, OUTCOMES_ASSESSOR)|Primary Purpose: TREATMENT",2017-03-01,2019-12-31,"Yueyang Hospital of Integrated Traditional Chinese and Western Medicine,Shanghai University of Traditional Chinese Medicine, Shanghai, Shanghai, 200437, China"
NCT00175110,The Effect of Hibiscus Sabdariffa L. Tea on Blood Pressure,https://clinicaltrials.gov/study/NCT00175110,COMPLETED,NO,Hypertension,BEHAVIORAL: herbal therapy/botanical therapy (Hibiscus sabdariffa),Tufts University,Celestial Seasonings|Tufts Medical Center,ALL,"ADULT, OLDER_ADULT",66,OTHER,INTERVENTIONAL,"Allocation: RANDOMIZED|Intervention Model: PARALLEL|Masking: DOUBLE (PARTICIPANT, INVESTIGATOR)|Primary Purpose: TREATMENT",,2007-12,"Jean Mayer USDA Human Nutrition Research Center on Aging at Tufts University, Boston, Massachusetts, 02111, United States"
NCT06336993,Evaluation of Clinical Efficacy of Herbal Compound in the Treatment of NSLBP,https://clinicaltrials.gov/study/NCT06336993,COMPLETED,NO,Low Back Pain,DRUG: herbal compound|DRUG: Celecoxib,Zhejiang Provincial Tongde Hospital,,ALL,"ADULT, OLDER_ADULT",71,OTHER,INTERVENTIONAL,Allocation: RANDOMIZED|Intervention Model: PARALLEL|Masking: NONE|Primary Purpose: TREATMENT,2022-01-01,2023-12-15,"Tongde Hospital, Hangzhou, Zhejiang, 310000, China"
NCT01486186,Effect of Traditional Chinese Medicine on Outcomes in Patients With Mild/Moderate Chronic Obstructive Pulmonary Disease,https://clinicaltrials.gov/study/NCT01486186,UNKNOWN,NO,"Pulmonary Disease, Chronic Obstructive",DRUG: Traditional Chinese Medicine|DRUG: placebo chinese medicine,Henan University of Traditional Chinese Medicine,,ALL,"ADULT, OLDER_ADULT",504,OTHER,INTERVENTIONAL,"Allocation: RANDOMIZED|Intervention Model: PARALLEL|Masking: QUADRUPLE (PARTICIPANT, CARE_PROVIDER, INVESTIGATOR, OUTCOMES_ASSESSOR)|Primary Purpose: TREATMENT",2011-12,2014-12,
NCT01997814,Role of Herbal Immunomodulators in the Treatment of Chronic Periodontitis,https://clinicaltrials.gov/study/NCT01997814,COMPLETED,NO,Chronic Periodontitis,DRUG: herbal immunomodulator|DRUG: Placebo,Tatyasaheb Kore Dental College,,ALL,ADULT,60,OTHER,INTERVENTIONAL,"Allocation: RANDOMIZED|Intervention Model: PARALLEL|Masking: TRIPLE (PARTICIPANT, CARE_PROVIDER, INVESTIGATOR)|Primary Purpose: TREATMENT",2012-03,2013-10,"Tatyasaheb Kore Dental College and Research Centre, New Pargaon, Kolhapur, Maharashtra, 416137, India"
NCT02642250,Comparative Evaluation of Herbal and Allopathic Drugs for the Treatment of Chronic Diarrhea,https://clinicaltrials.gov/study/NCT02642250,COMPLETED,NO,Chronic Diarrhea,DRUG: Metronidazole|DRUG: Entoban,Shifa Ul Mulk Memorial Hospital,,ALL,ADULT,70,OTHER,INTERVENTIONAL,Allocation: RANDOMIZED|Intervention Model: PARALLEL|Masking: NONE|Primary Purpose: TREATMENT,2015-01,2015-12,"Shifa Ul MUlk Memorial Hospital, Karachi, Pakistan"
NCT01613183,Exploratory Study of Effective Core Formula of Chinese Medicine to Treat Primary Insomnia,https://clinicaltrials.gov/study/NCT01613183,UNKNOWN,NO,Primary Insomnia,DRUG: Chinese herbal Medicine|OTHER: the dummy of a Chinese Medicine prescription,China Academy of Chinese Medical Sciences,,ALL,"ADULT, OLDER_ADULT",2,OTHER,INTERVENTIONAL,"Allocation: RANDOMIZED|Intervention Model: PARALLEL|Masking: TRIPLE (PARTICIPANT, CARE_PROVIDER, INVESTIGATOR)|Primary Purpose: TREATMENT",2012-05,,"Guang'anmen hospital, China Academy of Chinese Medical Sciences, Beijing, 100700, China"
NCT05458687,Traditional Chinese Medicine for Complications in Critically Ill Patients,https://clinicaltrials.gov/study/NCT05458687,UNKNOWN,NO,Critically Ill Patients,OTHER: Chinese herbal medicine decoction、Acupuncture or Laser acupuncture pen treatment、Acupoint Tuina massage、Acupoint application、Nursing/Diet and health education and guidance,China Medical University Hospital,,ALL,"ADULT, OLDER_ADULT",80,OTHER,INTERVENTIONAL,Allocation: RANDOMIZED|Intervention Model: PARALLEL|Masking: NONE|Primary Purpose: TREATMENT,2022-06-21,2023-06-20,"China Medical University Hospital, Taichung, 404, Taiwan"
NCT05420987,Effect of Jing Si Herbal Tea on Inflammation in Patients With Cardiovascular Disease,https://clinicaltrials.gov/study/NCT05420987,UNKNOWN,NO,Inflammatory Response|Gut Microbiome|Life Quality|Trimethylamine N-oxide|Cardiovascular Diseases|Herbal Medicine,DIETARY_SUPPLEMENT: Jing Si herbal tea liquid packet,Buddhist Tzu Chi General Hospital,,ALL,"ADULT, OLDER_ADULT",100,OTHER,INTERVENTIONAL,"Allocation: RANDOMIZED|Intervention Model: PARALLEL|Masking: QUADRUPLE (PARTICIPANT, CARE_PROVIDER, INVESTIGATOR, OUTCOMES_ASSESSOR)|Primary Purpose: SUPPORTIVE_CARE",2022-06,2024-12,
NCT06807515,Pilot Observational Study and Safety Analysis of FL Nourish Capsules in Cancer Patients in Remission,https://clinicaltrials.gov/study/NCT06807515,NOT_YET_RECRUITING,NO,Cancer|Cancer Survivor,,Thong Chai Institute of Medical Research,,ALL,"ADULT, OLDER_ADULT",24,OTHER,OBSERVATIONAL,Observational Model: |Time Perspective: p,2025-02-10,2027-08-09,
NCT02975011,Effectiveness and Safety of Korean Medicine for Lumbar Stenosis Patients With Sciatica,https://clinicaltrials.gov/study/NCT02975011,TERMINATED,NO,Lumbar Spinal Stenosis,DRUG: Herbal medicine|PROCEDURE: Chuna manipulation|PROCEDURE: Bee venom pharmacopuncture|PROCEDURE: Pharmacopuncture|PROCEDURE: Acupuncture|PROCEDURE: Electroacupuncture|PROCEDURE: Cupping|OTHER: Other intervention(s),Jaseng Medical Foundation,,ALL,"ADULT, OLDER_ADULT",38,OTHER,OBSERVATIONAL,Observational Model: |Time Perspective: p,2017-03-04,2018-11-02,"Jaseng Medical Foundation, Seoul, Korea, Republic of"
NCT02442960,Evaluating Safety and Efficacy of Herbal Treatment in Ulcerative Colitis,https://clinicaltrials.gov/study/NCT02442960,COMPLETED,NO,Ulcerative Colitis,DRUG: Herbal treatment (SA100),Stanford University,,ALL,"CHILD, ADULT, OLDER_ADULT",15,OTHER,INTERVENTIONAL,Allocation: NON_RANDOMIZED|Intervention Model: SINGLE_GROUP|Masking: NONE|Primary Purpose: TREATMENT,2014-12,2017-07-26,"Stanford University, Palo Alto, California, 94306, United States"
NCT02879006,"E-B-FAHF-2, Multi OIT and Xolair (Omalizumab) for Food Allergy",https://clinicaltrials.gov/study/NCT02879006,UNKNOWN,NO,Food Allergy,DRUG: Chinese Herbal Medication|DRUG: Placebo|DRUG: Omalizumab|DRUG: Multi OIT,Xiu-Min Li,,ALL,"CHILD, ADULT",33,OTHER,INTERVENTIONAL,"Allocation: RANDOMIZED|Intervention Model: PARALLEL|Masking: QUADRUPLE (PARTICIPANT, CARE_PROVIDER, INVESTIGATOR, OUTCOMES_ASSESSOR)|Primary Purpose: TREATMENT",2016-08,2020-11,"Johns Hopkins University, Baltimore, Maryland, 21287, United States|Icahn School of Medicine at Mount Sinai, New York, New York, 10029, United States"
NCT02032251,Reduction of Sperm DNA Fragmentation by Oral Ginger,https://clinicaltrials.gov/study/NCT02032251,COMPLETED,NO,Infertility,DRUG: oral administration of ginger|DRUG: Placebo,Royan Institute,,MALE,ADULT,71,OTHER_GOV,INTERVENTIONAL,"Allocation: RANDOMIZED|Intervention Model: PARALLEL|Masking: DOUBLE (PARTICIPANT, INVESTIGATOR)|Primary Purpose: TREATMENT",2009-12,2010-11,"Royan Institute, Tehran, Iran, Islamic Republic of"
NCT00329212,The Pharmacokinetics Study of Concentrated Herbal Formula and Traditional Herbal Decoctions in Humans,https://clinicaltrials.gov/study/NCT00329212,COMPLETED,NO,Healthy,DRUG: San Huang Xie Jin Tang,Committee on Chinese Medicine and Pharmacy,,ALL,ADULT,,OTHER_GOV,OBSERVATIONAL,Observational Model: |Time Perspective: p,,,"Committee on Chinese Medicine and Pharmacy, Department of Health, Taipei, Taiwan, China"
NCT00817024,Study of Herbal Formula Corresponding to Syndrome in Treating Post Percutaneous Coronary Intervention (PCI) Patients With Coronary Heart Disease (CHD),https://clinicaltrials.gov/study/NCT00817024,COMPLETED,NO,Coronary Heart Disease,"DRUG: Xuefu Zhuyu Capsules Plus Placebo of Sheng Mai Capsules,|DRUG: Sheng Mai Capsules Plus Placebo of Xuefu Zhuyu Capsules|DRUG: Placebo of Xuefu Zhuyu Capsules Plus Placebo of Sheng Mai Capsules",Guang'anmen Hospital of China Academy of Chinese Medical Sciences,Beijing Anzhen Hospital,ALL,"ADULT, OLDER_ADULT",90,OTHER,INTERVENTIONAL,"Allocation: RANDOMIZED|Intervention Model: PARALLEL|Masking: QUADRUPLE (PARTICIPANT, CARE_PROVIDER, INVESTIGATOR, OUTCOMES_ASSESSOR)|Primary Purpose: TREATMENT",2008-03,2009-03,"Guang'an Men Hospital, Beijing, 100053, China"
NCT05459493,A Clinical Study of Chinese Herbal Compound TJAOA101 in Therapy of Diminished Ovarian Reserve,https://clinicaltrials.gov/study/NCT05459493,UNKNOWN,NO,Diminished Ovarian Reserve,DRUG: TJAOA101,Tongji Hospital,,FEMALE,ADULT,100,OTHER,INTERVENTIONAL,Allocation: NA|Intervention Model: SINGLE_GROUP|Masking: NONE|Primary Purpose: TREATMENT,2022-11-01,2023-11-01,"Tongji Hospital, Tongji Medical College, Huazhong University of Science and Technology, Wuhan, China"
NCT05499312,An Innovative Chinese Herbal Formula for the Treatment of Gout,https://clinicaltrials.gov/study/NCT05499312,UNKNOWN,NO,Gout,DRUG: HKIIM-KU formula|DRUG: Placebo,Chinese University of Hong Kong,,ALL,"ADULT, OLDER_ADULT",80,OTHER,INTERVENTIONAL,"Allocation: RANDOMIZED|Intervention Model: PARALLEL|Masking: TRIPLE (PARTICIPANT, INVESTIGATOR, OUTCOMES_ASSESSOR)|Primary Purpose: TREATMENT",2022-10-11,2025-02,"The Chinese University of Hong Kong, Sha Tin, Hong Kong"
NCT05415579,Demyelinating Diseases of the Central Nervous System Registry for Patients With Traditional Chinese Medicine (DATE-TCM),https://clinicaltrials.gov/study/NCT05415579,NOT_YET_RECRUITING,NO,Demyelinating Diseases of the Central Nervous System (DDC),OTHER: Traditional Chinese medicine (TCM),"Dongzhimen Hospital, Beijing",,ALL,"ADULT, OLDER_ADULT",2000,OTHER,OBSERVATIONAL,Observational Model: |Time Perspective: p,2022-06-20,2030-05-31,
NCT06023420,Efficacy of a Herbal Formula for Bone Metastases,https://clinicaltrials.gov/study/NCT06023420,NOT_YET_RECRUITING,NO,Bone Metastases,DRUG: 4 Herbs Formula,Chinese University of Hong Kong,,FEMALE,"ADULT, OLDER_ADULT",36,OTHER,INTERVENTIONAL,Allocation: RANDOMIZED|Intervention Model: PARALLEL|Masking: NONE|Primary Purpose: SUPPORTIVE_CARE,2024-02-01,2025-01-01,
NCT05739071,JING SI HERBAL TEA and Urinary Tract Symptoms in Bladder Cancer,https://clinicaltrials.gov/study/NCT05739071,ENROLLING_BY_INVITATION,NO,Lower Urinary Tract Symptoms|Intravenous Drug Usage|Bladder Cancer|Herbal Interaction,DIETARY_SUPPLEMENT: JING SI HERBAL TEA|DIETARY_SUPPLEMENT: Placebo,"Taipei Tzu Chi Hospital, Buddhist Tzu Chi Medical Foundation",,ALL,"ADULT, OLDER_ADULT",100,OTHER,INTERVENTIONAL,"Allocation: RANDOMIZED|Intervention Model: PARALLEL|Masking: DOUBLE (PARTICIPANT, CARE_PROVIDER)|Primary Purpose: TREATMENT",2023-03,2027-12-31,"Buddhist Tzu Chi General Hospital, Taipei branch, Taipei, 231, Taiwan"
NCT03173040,The Efficacy of the Traditional Chinese Medicine Niubang Pill Combined With Methotrexate on Active Rheumatoid Arthritis,https://clinicaltrials.gov/study/NCT03173040,UNKNOWN,NO,Niu Bang Zi Pill|Rheumatoid Arthritis,DRUG: NiuBangZi pill or NiuBangZi pill placebo,Cui xuejun,Shanghai Yueyang Integrated Medicine Hospital|Longhua Hospital|Shanghai 7th People's Hospital,ALL,"ADULT, OLDER_ADULT",100,OTHER,INTERVENTIONAL,"Allocation: RANDOMIZED|Intervention Model: PARALLEL|Masking: QUADRUPLE (PARTICIPANT, CARE_PROVIDER, INVESTIGATOR, OUTCOMES_ASSESSOR)|Primary Purpose: TREATMENT",2018-07,2018-12,"Longhua Hospital, Shanghai, Shanghai, China"
NCT01419210,Pilot Program to Personalize Care & Improve Quality of Life for Women With Ovarian Cancer,https://clinicaltrials.gov/study/NCT01419210,COMPLETED,NO,Ovarian Cancer,OTHER: Pre-study Questionnaire|OTHER: Educational Presentations|OTHER: CAM Therapies|OTHER: Post-study Questionnaire,H. Lee Moffitt Cancer Center and Research Institute,University of South Florida,FEMALE,"ADULT, OLDER_ADULT",28,OTHER,INTERVENTIONAL,Allocation: NA|Intervention Model: SINGLE_GROUP|Masking: NONE|Primary Purpose: SUPPORTIVE_CARE,2010-01,2015-09,"H. Lee Moffitt Cancer Center and Research Institute, Tampa, Florida, 33612, United States"
NCT05897203,Clinical Trial of Natural Therapeutics for COVID-19 and Other Acute Respiratory Viral Infections,https://clinicaltrials.gov/study/NCT05897203,RECRUITING,NO,Acute Respiratory Infection,DRUG: TAZCOV|DRUG: Vidicine,Makerere University,"Makerere University Lung Institute|MRC/UVRI and LSHTM Uganda Research Unit|Directorate of Government Analytical Laboratories|Makerere University College of Veterinary Medicine, Animal Resources and Bio-security|Makerere University Biomedical Research Centre|Natural Chemotherapeutics Research Institute",ALL,"ADULT, OLDER_ADULT",510,OTHER,INTERVENTIONAL,Allocation: RANDOMIZED|Intervention Model: PARALLEL|Masking: SINGLE (PARTICIPANT)|Primary Purpose: TREATMENT,2023-03-03,2024-01,"Mulago National Referral Hospital, Kampala, Central, Uganda"
NCT05522621,A Muticenter Clinical Study of Chinese Herbal Compound TJAOA102 in Alleviating Menopausal Syndrome,https://clinicaltrials.gov/study/NCT05522621,NOT_YET_RECRUITING,NO,Menopausal Syndrome,DRUG: TJAOA102,Tongji Hospital,,FEMALE,ADULT,100,OTHER,INTERVENTIONAL,Allocation: NA|Intervention Model: SINGLE_GROUP|Masking: NONE|Primary Purpose: TREATMENT,2022-10-01,2025-10-01,
NCT01408849,Use of Maytenus Ilicifolia in the Treatment of Dyspepsia,https://clinicaltrials.gov/study/NCT01408849,TERMINATED,NO,Dyspepsia,DRUG: Maytenus ilicifolia leaves infusion|DRUG: Omeprazole,Casa Espirita Terra de Ismael,University of Sao Paulo,ALL,"ADULT, OLDER_ADULT",4,OTHER,INTERVENTIONAL,Allocation: RANDOMIZED|Intervention Model: PARALLEL|Masking: SINGLE (OUTCOMES_ASSESSOR)|Primary Purpose: TREATMENT,2015-02,2016-01,"Hospital das Clinicas FMRP-USP, Ribeirao Preto, SP, 14049-900, Brazil"
NCT02855658,Modulation of Immunity-related Gene Expression Under the Chinese Herbal Formula SS-1 Treatment for Sjögren's Syndrome,https://clinicaltrials.gov/study/NCT02855658,UNKNOWN,NO,Sjögren's Syndrome,DRUG: SS-1|DRUG: Placebo,China Medical University Hospital,"Chang Gung Memorial Hospital|China Medical University, China|National Research Program for Biopharmaceuticals, Taiwan",ALL,"ADULT, OLDER_ADULT",90,OTHER,INTERVENTIONAL,"Allocation: RANDOMIZED|Intervention Model: CROSSOVER|Masking: QUADRUPLE (PARTICIPANT, CARE_PROVIDER, INVESTIGATOR, OUTCOMES_ASSESSOR)|Primary Purpose: TREATMENT",2014-02,2017-04,"Taoyuan Chang Gung Memorial Hospital, Gueishan Township, 333, Taiwan|China Medical University Hospital, Taichung, 404, Taiwan"
NCT04275219,Safety and Efficacy of the Tong-Fu-Xing-Shen Herbal Formula for Stroke-Associated Pneumonia,https://clinicaltrials.gov/study/NCT04275219,UNKNOWN,NO,Stroke|Complication,DRUG: Tongfu capsules|DRUG: The Placebo of Tongfu capsules,Guangzhou University of Traditional Chinese Medicine,People's Hospital of Ganzhou City|People's Hospital of Lianjiang City|Yangjiang Hospital of Traditional Chinese Medicine|Shenyang No. 2 Hospital of Traditional Chinese Medicine|Guangdong Provincial Hospital of Traditional Chinese Medicine,ALL,"ADULT, OLDER_ADULT",218,OTHER,INTERVENTIONAL,"Allocation: RANDOMIZED|Intervention Model: PARALLEL|Masking: QUADRUPLE (PARTICIPANT, CARE_PROVIDER, INVESTIGATOR, OUTCOMES_ASSESSOR)|Primary Purpose: TREATMENT",2019-03-15,2021-12,"Guangdong Province Hospital of Tradtional Chinese Medicine, Guangzhou, Guangdong, 510120, China"
NCT04601792,A Series of N-of-1 Trials of Traditional Chinese Medicine Based on Bayesian Method,https://clinicaltrials.gov/study/NCT04601792,UNKNOWN,NO,Bronchiectasis|Quality of Life|Traditional Chinese Medicine|Sputum|Symptoms|Individuality,DRUG: Individualized Decoction|DRUG: placebo|DRUG: Tested drug minus heat-clearing herbs,Shanghai University of Traditional Chinese Medicine,Guangzhou University of Traditional Chinese Medicine,ALL,"ADULT, OLDER_ADULT",71,OTHER,INTERVENTIONAL,"Allocation: RANDOMIZED|Intervention Model: CROSSOVER|Masking: QUADRUPLE (PARTICIPANT, CARE_PROVIDER, INVESTIGATOR, OUTCOMES_ASSESSOR)|Primary Purpose: TREATMENT",2019-12-01,2022-12-31,"Yueyang Hospital of Integrated Traditional Chinese and Western Medicine, Shanghai University of Traditional Chinese Medicine, Shanghai, 200437, China"
NCT01674374,Botanical Therapy in Treating Mucositis in Patients With Head and Neck Cancer Who Have Undergone Chemoradiation Therapy,https://clinicaltrials.gov/study/NCT01674374,WITHDRAWN,NO,Mucositis|Recurrent Squamous Cell Carcinoma of the Hypopharynx|Recurrent Squamous Cell Carcinoma of the Larynx|Recurrent Squamous Cell Carcinoma of the Lip and Oral Cavity|Recurrent Squamous Cell Carcinoma of the Nasopharynx|Recurrent Squamous Cell Carcinoma of the Oropharynx|Recurrent Squamous Cell Carcinoma of the Paranasal Sinus and Nasal Cavity|Recurrent Verrucous Carcinoma of the Larynx|Recurrent Verrucous Carcinoma of the Oral Cavity|Stage III Squamous Cell Carcinoma of the Hypopharynx|Stage III Squamous Cell Carcinoma of the Larynx|Stage III Squamous Cell Carcinoma of the Lip and Oral Cavity|Stage III Squamous Cell Carcinoma of the Nasopharynx|Stage III Squamous Cell Carcinoma of the Oropharynx|Stage III Squamous Cell Carcinoma of the Paranasal Sinus and Nasal Cavity|Stage III Verrucous Carcinoma of the Larynx|Stage III Verrucous Carcinoma of the Oral Cavity|Stage IV Squamous Cell Carcinoma of the Hypopharynx|Stage IV Squamous Cell Carcinoma of the Nasopharynx|Stage IVA Squamous Cell Carcinoma of the Larynx|Stage IVA Squamous Cell Carcinoma of the Lip and Oral Cavity|Stage IVA Squamous Cell Carcinoma of the Oropharynx|Stage IVA Squamous Cell Carcinoma of the Paranasal Sinus and Nasal Cavity|Stage IVA Verrucous Carcinoma of the Larynx|Stage IVA Verrucous Carcinoma of the Oral Cavity|Stage IVB Squamous Cell Carcinoma of the Larynx|Stage IVB Squamous Cell Carcinoma of the Lip and Oral Cavity|Stage IVB Squamous Cell Carcinoma of the Oropharynx|Stage IVB Squamous Cell Carcinoma of the Paranasal Sinus and Nasal Cavity|Stage IVB Verrucous Carcinoma of the Larynx|Stage IVB Verrucous Carcinoma of the Oral Cavity|Tongue Cancer,OTHER: placebo|PROCEDURE: quality-of-life assessment|OTHER: questionnaire administration|DRUG: Vaccinium myrtillus/Macleaya cordata/Echinacea angustifolia extract granules,Roswell Park Cancer Institute,National Cancer Institute (NCI),ALL,"ADULT, OLDER_ADULT",0,OTHER,INTERVENTIONAL,Allocation: RANDOMIZED|Intervention Model: PARALLEL|Masking: DOUBLE|Primary Purpose: SUPPORTIVE_CARE,2013-05,,
NCT04967755,Jing-Si-Herbal-Tea Accelerates SARS-Cov-2 Load Reduction Among COVID-19 Patients,https://clinicaltrials.gov/study/NCT04967755,UNKNOWN,NO,Coronavirus,DRUG: Jing-Si-Herbal-Tea,Yao-Kuang Wu,,ALL,"ADULT, OLDER_ADULT",200,OTHER,INTERVENTIONAL,Allocation: NA|Intervention Model: SINGLE_GROUP|Masking: NONE|Primary Purpose: TREATMENT,2021-06-01,2021-09-30,"Taipei Tzu chi hospital,The Buddhist medical fundation., Taipei, 231, Taiwan"
NCT01780480,Dynamic Combination Therapy on Chinese Herbal Granules to Improve the Symptoms in Convalescent Phase of Ischemic Stroke,https://clinicaltrials.gov/study/NCT01780480,COMPLETED,NO,Ischemic Stroke|Convalescence,DRUG: Dynamic Chinese herbal granule formula|DRUG: Placebo|PROCEDURE: Standard medical care,China Academy of Chinese Medical Sciences,National Natural Science Foundation of China,ALL,"ADULT, OLDER_ADULT",120,OTHER,INTERVENTIONAL,"Allocation: RANDOMIZED|Intervention Model: PARALLEL|Masking: QUADRUPLE (PARTICIPANT, CARE_PROVIDER, INVESTIGATOR, OUTCOMES_ASSESSOR)|Primary Purpose: TREATMENT",2013-01,2014-12,"The First Affiliated Hospital of Guiyang College of Traditional Chinese Medicine, Guiyang, Guizhou, China"
NCT00001695,Survey of the Use of Alternative Medical Therapies in Adult Cancer Patients Enrolled in Phase I Clinical Trials,https://clinicaltrials.gov/study/NCT00001695,COMPLETED,NO,Neoplasm,,National Cancer Institute (NCI),,ALL,"CHILD, ADULT, OLDER_ADULT",125,NIH,OBSERVATIONAL,Observational Model: |Time Perspective: p,1998-04,2002-01,"National Cancer Institute (NCI), Bethesda, Maryland, 20892, United States"
NCT01347658,Drug Interactions Between Echinacea Purpurea and Etravirine,https://clinicaltrials.gov/study/NCT01347658,COMPLETED,NO,HIV,DIETARY_SUPPLEMENT: Echinacea purpurea,"Fundación FLS de Lucha Contra el Sida, las Enfermedades Infecciosas y la Promoción de la Salud y la Ciencia",,ALL,"ADULT, OLDER_ADULT",15,OTHER,INTERVENTIONAL,Allocation: NA|Intervention Model: SINGLE_GROUP|Masking: NONE|Primary Purpose: TREATMENT,2011-04,2011-08,"Hospital Germans Trias i Pujol, Badalona, Barcelona, 08916, Spain"
NCT05212298,Effects of Herbal Sleep Formula on Patients With Insomnia and Tinnitus,https://clinicaltrials.gov/study/NCT05212298,RECRUITING,NO,Sleep Disturbances|Tinnitus,DIETARY_SUPPLEMENT: The gel contains a mixture of glucose and maltodextrin|DIETARY_SUPPLEMENT: Herbal compound low-dose|DIETARY_SUPPLEMENT: Herbal compound high-dose,Dalin Tzu Chi General Hospital,,ALL,"ADULT, OLDER_ADULT",120,OTHER,INTERVENTIONAL,"Allocation: RANDOMIZED|Intervention Model: PARALLEL|Masking: DOUBLE (PARTICIPANT, CARE_PROVIDER)|Primary Purpose: SUPPORTIVE_CARE",2021-09-16,2025-01-30,"Dalin Tzu Chi Hospital, Buddhist Tzu Chi Medical Foundation, Chiayi City, 66247, Taiwan"
NCT04108832,Traditional Chinese Medicine Formula Liu-Wei-Die-Huang-Wan in the Treatment of Osteoarthritis.,https://clinicaltrials.gov/study/NCT04108832,COMPLETED,NO,Osteoarthritis,DRUG: TCM OA2|DRUG: PLACEBO,Chung Shan Medical University,,ALL,"ADULT, OLDER_ADULT",81,OTHER,INTERVENTIONAL,"Allocation: RANDOMIZED|Intervention Model: PARALLEL|Masking: TRIPLE (PARTICIPANT, CARE_PROVIDER, INVESTIGATOR)|Primary Purpose: BASIC_SCIENCE",2012-01,2013-10,"Chung Shan Medical University Hospital, Taichung, 402, Taiwan"
