NCT Number,Study Title,Study URL,Study Status,Study Results,Conditions,Interventions,Sponsor,Collaborators,Sex,Age,Enrollment,Funder Type,Study Type,Study Design,Start Date,Completion Date,Locations
NCT02113111,Effects of Fasting on Self Efficacy,https://clinicaltrials.gov/study/NCT02113111,COMPLETED,NO,Chronic Pain|Fibromyalgia|Rheumatoid Arthritis|Gout|Headache|Arthritis|Gastrointestinal Diseases|Irritable Bowel Syndrome|Inflammatory Bowel Disease|Cardiovascular Diseases,BEHAVIORAL: Fasting,Universität Duisburg-Essen,,ALL,"ADULT, OLDER_ADULT",120,OTHER,OBSERVATIONAL,Observational Model: |Time Perspective: p,2014-04,2015-09,"Department of Internal and Integrative Medicine, Kliniken Essen-Mitte, Essen, 45276, Germany"
NCT02074579,A Safety and Efficacy Study of Daikenchuto (TU-100) to Relieve Abdominal Bloating in Female Subjects With Irritable Bowel Syndrome,https://clinicaltrials.gov/study/NCT02074579,COMPLETED,NO,Irritable Bowel Syndrome in Females,DRUG: TU-100|DRUG: Placebo,Tsumura USA,ICON Clinical Research,FEMALE,"ADULT, OLDER_ADULT",101,INDUSTRY,INTERVENTIONAL,"Allocation: RANDOMIZED|Intervention Model: PARALLEL|Masking: QUADRUPLE (PARTICIPANT, CARE_PROVIDER, INVESTIGATOR, OUTCOMES_ASSESSOR)|Primary Purpose: TREATMENT",2014-07,2016-04,"Oppenheimer Family Center for Neurobiology of Stress Division of Digestive Diseases David Geffen School of Medicine at UCLA, Los Angeles, California, 90095, United States"
NCT06570668,"Safety, Tolerability and Pharmacokinetics of CDD-2101 in Health Volunteers",https://clinicaltrials.gov/study/NCT06570668,COMPLETED,NO,Constipation - Functional,DRUG: CDD-2101,Centre for Chinese Herbal Medicine Drug Development Limited,,ALL,"ADULT, OLDER_ADULT",20,OTHER,INTERVENTIONAL,"Allocation: RANDOMIZED|Intervention Model: PARALLEL|Masking: TRIPLE (PARTICIPANT, CARE_PROVIDER, INVESTIGATOR)|Primary Purpose: TREATMENT",2024-05-29,2024-07-12,"Biotrial Inc, Newark, New Jersey, 07103, United States"
NCT04410510,P2Et Extract in the Symptomatic Treatment of Subjects With COVID-19,https://clinicaltrials.gov/study/NCT04410510,UNKNOWN,NO,COVID|Coronavirus Infection|SARS-CoV 2|COVID19,DRUG: P2Et (Caesalpinia spinosa extract)|OTHER: Placebo,Hospital Universitario San Ignacio,Pontificia Universidad Javeriana,ALL,"ADULT, OLDER_ADULT",100,OTHER,INTERVENTIONAL,"Allocation: RANDOMIZED|Intervention Model: PARALLEL|Masking: TRIPLE (PARTICIPANT, CARE_PROVIDER, INVESTIGATOR)|Primary Purpose: SUPPORTIVE_CARE",2020-09-30,2021-11-30,"Hospital Universitario San Ignacio, Bogotá, Colombia"
NCT05621590,"MLC901 in Hypoxic-ischemic Brain Injury Patients; A Double-blind, Randomized Placebo-controlled Trial",https://clinicaltrials.gov/study/NCT05621590,COMPLETED,NO,Hypoxic Ischaemic Encephalopathy Due to Cardiac Arrest,DRUG: MLC 901|DRUG: Placebo,Shahid Beheshti University of Medical Sciences,,ALL,"CHILD, ADULT, OLDER_ADULT",35,OTHER,INTERVENTIONAL,"Allocation: RANDOMIZED|Intervention Model: PARALLEL|Masking: DOUBLE (PARTICIPANT, INVESTIGATOR)|Primary Purpose: TREATMENT",2020-03-10,2022-08-12,"Shahid Beheshti University of Medical Sciences, Shohada Hospital, Tehran, Iran, Islamic Republic of"
NCT05684523,Feasibility Study on the Use of Redormin®500 on Day-time Cognition,https://clinicaltrials.gov/study/NCT05684523,COMPLETED,NO,"Sleep Disorders, Circadian Rhythm|Cognitive Dysfunction",DRUG: Valerian-Hop Extract|DRUG: Placebo,Max Zeller Soehne AG,University of Basel,ALL,"ADULT, OLDER_ADULT",40,INDUSTRY,INTERVENTIONAL,"Allocation: RANDOMIZED|Intervention Model: PARALLEL|Masking: DOUBLE (PARTICIPANT, INVESTIGATOR)|Primary Purpose: OTHER",2023-03-01,2023-12-20,"Research Platform MCN University of Basel, Basel, Baselstadt, 4055, Switzerland"
NCT02919735,"Efficacy, Safety and Tolerability of CG428 Cutaneous Solution on Chemotherapy Induced Alopecia; Controlled Study (ELAN)",https://clinicaltrials.gov/study/NCT02919735,COMPLETED,NO,Alopecia,DRUG: CG 428 cutaneous solution|DRUG: Placebo cutaneous solution,Legacy Healthcare SA,,FEMALE,"ADULT, OLDER_ADULT",40,INDUSTRY,INTERVENTIONAL,"Allocation: RANDOMIZED|Intervention Model: PARALLEL|Masking: DOUBLE (PARTICIPANT, INVESTIGATOR)|Primary Purpose: SUPPORTIVE_CARE",2016-10,2019-03-01,"CHUV Lausanne, Lausanne, 1011, Switzerland"
NCT01847924,NEURoaid II (MLC 901) Assessment in Cognitively Impaired Not Demented Subjects,https://clinicaltrials.gov/study/NCT01847924,COMPLETED,NO,Cognitive Impairment,DRUG: MLC901|DRUG: Placebo,"National University Hospital, Singapore",,ALL,"ADULT, OLDER_ADULT",103,OTHER,INTERVENTIONAL,"Allocation: RANDOMIZED|Intervention Model: PARALLEL|Masking: QUADRUPLE (PARTICIPANT, CARE_PROVIDER, INVESTIGATOR, OUTCOMES_ASSESSOR)|Primary Purpose: TREATMENT",2013-03,2018-04,"University of Santo Tomas Hospital, Manila City, Metro Manila, 1015, Philippines|National University Hospital, Singapore, 119074, Singapore|Singapore General Hospital, Singapore, 169608, Singapore|National Neuroscience Institute, Singapore, 308433, Singapore|National Geriatric Hospital, Hanoi, Vietnam"
NCT02750189,The Economic Burden of Chronic Obstructive Pulmonary Disease(COPD) in South Korea,https://clinicaltrials.gov/study/NCT02750189,COMPLETED,NO,COPD|Chronic Obstructive Pulmonary Disease,OTHER: Direct cost|OTHER: Indirect cost,Konkuk University Medical Center,GlaxoSmithKline,ALL,"ADULT, OLDER_ADULT",390,OTHER,OBSERVATIONAL,Observational Model: |Time Perspective: p,2015-09,2017-01,"Konkuk University Hospital, Gwangjin gu, Seoul, 05030, Korea, Republic of"
NCT00064857,Pycnogenol for the Treatment of Lymphedema of the Arm in Breast Cancer Survivors,https://clinicaltrials.gov/study/NCT00064857,COMPLETED,NO,Lymphedema|Breast|Cancer,DRUG: Pycnogenol,National Center for Complementary and Integrative Health (NCCIH),,ALL,"ADULT, OLDER_ADULT",26,NIH,INTERVENTIONAL,Allocation: RANDOMIZED|Intervention Model: PARALLEL|Masking: DOUBLE|Primary Purpose: TREATMENT,2003-08,2007-08,"University of Wisconsin Comprehensive Cancer Center and School of Pharmacy, Madison, Wisconsin, 53706, United States"
NCT06357273,The Effect of White Tea Consumption on Obesity,https://clinicaltrials.gov/study/NCT06357273,COMPLETED,NO,Obesity|Obesity; Endocrine|Obesity Adult Onset,,Recep Tayyip Erdogan University,,ALL,"ADULT, OLDER_ADULT",91,OTHER,OBSERVATIONAL,Observational Model: |Time Perspective: p,2023-07-01,2023-12-15,"Recep Tayyip Erdogan University, Rize, 53100, Turkey"
NCT03091634,The Efficacy and Safety of the Xue-Fu-Zhu-Yu Capsule in Treatment of Qi Stagnation and Blood Stasis Syndrome.,https://clinicaltrials.gov/study/NCT03091634,COMPLETED,NO,Qi Stagnation and Blood Stasis Syndrome,DRUG: xue-fu-zhu-yu capsule|DRUG: xue-fu-zhu-yu capsule simulated agent,Guang'anmen Hospital of China Academy of Chinese Medical Sciences,China Food and Drug Administration|Chinese Academy of Medical Sciences,ALL,"ADULT, OLDER_ADULT",120,OTHER,INTERVENTIONAL,"Allocation: RANDOMIZED|Intervention Model: PARALLEL|Masking: DOUBLE (PARTICIPANT, INVESTIGATOR)|Primary Purpose: TREATMENT",2017-05-06,2018-12-31,"Guang'anmen Hospital, China Academy of Chinese Medical Sciences, Beijing, 100053, China|Huguosi TCM Hospital Affiliated to Beijing University of CM, Beijing, China|Wangjing Hospital, China Academy of Chinese Medical Sciences, Beijing, China"
NCT05596006,Efficacy of ASIMOMMY® Compared to Domperidone and Placebo in Increasing Breastfeeding: Randomized Single-Blind Controlled Trial in Indonesia,https://clinicaltrials.gov/study/NCT05596006,COMPLETED,NO,Breastfeeding Mothers,DRUG: ASIMOMMY®|DRUG: Domperidon|DRUG: Placebo,Gadjah Mada University,,FEMALE,ADULT,45,OTHER,INTERVENTIONAL,"Allocation: RANDOMIZED|Intervention Model: PARALLEL|Masking: DOUBLE (PARTICIPANT, OUTCOMES_ASSESSOR)|Primary Purpose: TREATMENT",2022-12-31,2023-03-24,"Primary Health Center Jetis and Tegalrejo, Yogyakarta, DI Yogyakarta, 55242, Indonesia"
NCT06558071,Supplementation of Galatonol 300 mg / Striatin 30 mg in Postpartum Lactating Mothers,https://clinicaltrials.gov/study/NCT06558071,RECRUITING,NO,Lactation Induced,DRUG: Galatonol 300 mg/Striatin 30 mg|DRUG: Placebo,Dexa Medica Group,,FEMALE,ADULT,160,INDUSTRY,INTERVENTIONAL,"Allocation: RANDOMIZED|Intervention Model: PARALLEL|Masking: QUADRUPLE (PARTICIPANT, CARE_PROVIDER, INVESTIGATOR, OUTCOMES_ASSESSOR)|Primary Purpose: TREATMENT",2024-10-21,2025-06,"Klinik Pratama Anugrah Sleman, Sleman, Daerah Istimewa Yogyakarta, Indonesia|Private Midwife Practice (Bidan Anisa), Sleman, Daerah Istimewa Yogyakarta, Indonesia|Private Midwife Practice (Bidan Catur), Sleman, Daerah Istimewa Yogyakarta, Indonesia|Private Midwife Practice (Bidan Istri Utami), Sleman, Daerah Istimewa Yogyakarta, Indonesia|Private Midwife Practice (Bidan Istri Yuliani), Sleman, Daerah Istimewa Yogyakarta, Indonesia|Private Midwife Practice (Bidan Kisti), Sleman, Daerah Istimewa Yogyakarta, Indonesia|Private Midwife Practice (Bidan Mei), Sleman, Daerah Istimewa Yogyakarta, Indonesia|Private Midwife Practice (Bidan Tutik), Sleman, Daerah Istimewa Yogyakarta, Indonesia|Private Midwife Practice (Bidan Wati), Sleman, Daerah Istimewa Yogyakarta, Indonesia|Private Midwife Practice (Bidan Widya), Sleman, Daerah Istimewa Yogyakarta, Indonesia"
NCT04199455,Evidence-based Evaluation of TCM Key Syndrome Differentiation and Treatment for Acute Ischemic Stroke,https://clinicaltrials.gov/study/NCT04199455,UNKNOWN,NO,Ischemic Stroke,DRUG: Integrative Treatment (EPACH Recipe Granules + NQABC Recipe Granules)|DRUG: Placebo,Guangzhou University of Traditional Chinese Medicine,,ALL,"ADULT, OLDER_ADULT",500,OTHER,INTERVENTIONAL,"Allocation: RANDOMIZED|Intervention Model: PARALLEL|Masking: DOUBLE (PARTICIPANT, INVESTIGATOR)|Primary Purpose: TREATMENT",2019-12-04,2021-08-30,"Guangdong Provincial Hospital of Chinese medicine, Guangzhou, Guangdong, 510120, China"
NCT04852120,Compound Sodium Picosulfate Granules for Bowel Preparation in Chinese Population,https://clinicaltrials.gov/study/NCT04852120,COMPLETED,YES,Bowel Cleansing,OTHER: No intervention,Ferring Pharmaceuticals,DeltaMed,ALL,"CHILD, ADULT, OLDER_ADULT",3000,INDUSTRY,OBSERVATIONAL,Observational Model: |Time Perspective: p,2021-04-01,2022-12-31,"Ferring Investigational Site, Beijing, China|Ferring Investigational Site, Dalian, China|Ferring Investigational Site, Fuzhou, China|Ferring Investigational Site, Jingdezhen, China|Ferring Investigational Site, Nanjing, China|Ferring Investigational Site, Ningbo, China|Ferring Investigational Site, Qiqihar, China|Ferring Investigational Site, Xian, China"
NCT04459754,Fuzheng Yiliu-1010,https://clinicaltrials.gov/study/NCT04459754,UNKNOWN,NO,Colorectal Cancer Stage II and III,DRUG: Fuzheng Yiliu Formulation,Guangdong Provincial Hospital of Traditional Chinese Medicine,,ALL,"ADULT, OLDER_ADULT",189,OTHER,INTERVENTIONAL,Allocation: NON_RANDOMIZED|Intervention Model: PARALLEL|Masking: NONE|Primary Purpose: TREATMENT,2020-06-29,2024-12-31,"Guangdong Provincial Hospital of Chinese Medicine, Guangzhou, Guangdong, 510000, China"
NCT01066741,"Prevention of Radiation-induced Severe Oral Mucositis in Oral Cavity, Oropharynx, Hypopharynx, and Cavum Cancer",https://clinicaltrials.gov/study/NCT01066741,TERMINATED,NO,Oropharynx Cancer|Hypopharynx Cancer,DRUG: Homeodent®|DRUG: 1.4% Sodium Bicarbonate solution,Centre Leon Berard,BOIRON,ALL,"ADULT, OLDER_ADULT",78,OTHER,INTERVENTIONAL,Allocation: RANDOMIZED|Intervention Model: PARALLEL|Masking: SINGLE (INVESTIGATOR)|Primary Purpose: PREVENTION,2009-05,2011-08,"Centre Léon Bérard, Lyon, France"
NCT05497895,The Assessment of Clinical Efficacy of Topical Application of 5% Thymoquinone Gel for Gingivitis Patients,https://clinicaltrials.gov/study/NCT05497895,UNKNOWN,NO,Gingivitis,BIOLOGICAL: 5% thymoquinone (TQ) gel|BIOLOGICAL: SRP and placebo|PROCEDURE: Only SRP-one stage prophylaxis,King Abdulaziz University,,ALL,ADULT,70,OTHER,INTERVENTIONAL,"Allocation: RANDOMIZED|Intervention Model: PARALLEL|Masking: TRIPLE (PARTICIPANT, CARE_PROVIDER, INVESTIGATOR)|Primary Purpose: TREATMENT",2022-09,2022-11,"Qassim University, Buraydah, 52571, Saudi Arabia"
NCT06482671,Primary Care dySpEpsia rikkuNshiTo,https://clinicaltrials.gov/study/NCT06482671,NOT_YET_RECRUITING,NO,Dyspepsia and Other Specified Disorders of Function of Stomach|Postprandial Distress Syndrome,DRUG: Rikkunshi-to|OTHER: Placebo,Universitaire Ziekenhuizen KU Leuven,,ALL,"ADULT, OLDER_ADULT",100,OTHER,INTERVENTIONAL,"Allocation: RANDOMIZED|Intervention Model: PARALLEL|Masking: TRIPLE (PARTICIPANT, CARE_PROVIDER, INVESTIGATOR)|Primary Purpose: TREATMENT",2024-10-01,2026-10-01,"KU Leuven, Leuven, Vlaams-Brabant, 3000, Belgium"
NCT02452749,Prospective Safety and Tolerability Assessment of a Cardiovascular Health Dietary Supplement,https://clinicaltrials.gov/study/NCT02452749,COMPLETED,NO,Hypertension,DIETARY_SUPPLEMENT: Cardiovascular health dietary supplement,National University of Natural Medicine,,ALL,"ADULT, OLDER_ADULT",30,OTHER,INTERVENTIONAL,Allocation: NA|Intervention Model: SINGLE_GROUP|Masking: NONE|Primary Purpose: OTHER,2015-05-01,2017-07-28,"Helfgott Research Institute, Portland, Oregon, 97201, United States"
NCT04284449,"Integrative Therapy for Holistic, Natural Cognition and Lifestyle Rehabilitation",https://clinicaltrials.gov/study/NCT04284449,COMPLETED,NO,Cognitive Dysfunction,OTHER: Whole-practice cognitive optimization,National University of Natural Medicine,North County Natural Medicine,ALL,"ADULT, OLDER_ADULT",34,OTHER,OBSERVATIONAL,Observational Model: |Time Perspective: p,2020-02-24,2023-12-15,"North County Natural Medicine, Encinitas, California, 92024, United States"
NCT04029376,Study to Learn More About the Stomach and Intestine Complaints of Children Aged From 3 to 14 Years,https://clinicaltrials.gov/study/NCT04029376,COMPLETED,NO,Functional Gastrointestinal Disorders,DRUG: Iberogast®,Bayer,,ALL,CHILD,1032,INDUSTRY,OBSERVATIONAL,Observational Model: |Time Perspective: p,2007-04-01,2008-10-01,"Many locations, Multiple Locations, Germany"
NCT05778409,To Study the Effects of Cordyceps Cicadae on Vision Care,https://clinicaltrials.gov/study/NCT05778409,RECRUITING,NO,Myopia,BIOLOGICAL: Cordyceps cicadae extract,China Medical University Hospital,,ALL,"ADULT, OLDER_ADULT",60,OTHER,INTERVENTIONAL,Allocation: NA|Intervention Model: SINGLE_GROUP|Masking: NONE|Primary Purpose: PREVENTION,2023-03-08,2023-12-15,"Asia university, Taichung, 413, Taiwan"
NCT04059783,Study to Learn More About the Onset of Effect of Iberogast in Patients Suffering From Abnormal Stomach and Intestine Function,https://clinicaltrials.gov/study/NCT04059783,COMPLETED,NO,Functional Gastrointestinal Disorders,"DRUG: STW5 (Iberogast®, BAY98-7411)",Bayer,,ALL,"ADULT, OLDER_ADULT",272,INDUSTRY,OBSERVATIONAL,Observational Model: |Time Perspective: p,2008-06-17,2011-02-20,"Many locations, Multiple Locations, Germany"
NCT02565316,Efficacy of Nepeta Menthoides Extract on Anxiety of Patients With Depression: a Double-blind Randomized Controlled Clinical Trial,https://clinicaltrials.gov/study/NCT02565316,COMPLETED,NO,Depression|Anxiety,DRUG: Nepeta menthoides Boiss & Bohse freeze dried extract|DRUG: Sertraline,Shiraz University of Medical Sciences,,ALL,"ADULT, OLDER_ADULT",70,OTHER,INTERVENTIONAL,"Allocation: RANDOMIZED|Intervention Model: PARALLEL|Masking: QUADRUPLE (PARTICIPANT, CARE_PROVIDER, INVESTIGATOR, OUTCOMES_ASSESSOR)|Primary Purpose: TREATMENT",2014-11,2015-03,
NCT01332747,Clinical Study to Evaluate Antihyperlipidemic Effect of a Classical Unani Antiobesity Formulation,https://clinicaltrials.gov/study/NCT01332747,COMPLETED,NO,Hyperlipidemia,DRUG: safoof e muhazzil|DRUG: compressed tablet of safoof e muhazzil|DRUG: Atorvastatin,Jamia Hamdard University,,ALL,"ADULT, OLDER_ADULT",128,OTHER,INTERVENTIONAL,Allocation: RANDOMIZED|Intervention Model: PARALLEL|Masking: NONE|Primary Purpose: TREATMENT,2010-05,2011-05,"Majeedia Hospital, New Delhi, Delhi, 110062, India"
NCT06313905,EVADRY® in the Treatment of Xerostomia in Sjögren's Syndrome,https://clinicaltrials.gov/study/NCT06313905,NOT_YET_RECRUITING,NO,Sjogren's Syndrome,DIETARY_SUPPLEMENT: EVADRY|OTHER: Placebo,University Tunis El Manar,,ALL,"ADULT, OLDER_ADULT",180,OTHER,INTERVENTIONAL,"Allocation: RANDOMIZED|Intervention Model: PARALLEL|Masking: TRIPLE (PARTICIPANT, CARE_PROVIDER, OUTCOMES_ASSESSOR)|Primary Purpose: TREATMENT",2024-04-15,2025-12-31,
NCT03819439,Microbiome and Mycobiome Registry of Volunteers With and Without Autism Spectrum Disorder,https://clinicaltrials.gov/study/NCT03819439,COMPLETED,NO,Autism Spectrum Disorder,OTHER: Microbiome and Autism Questionnaire,University Hospitals Cleveland Medical Center,,ALL,"CHILD, ADULT, OLDER_ADULT",74,OTHER,OBSERVATIONAL,Observational Model: |Time Perspective: p,2019-01-30,2019-07-23,"University Hospitals Cleveland Medical Center, Cleveland, Ohio, 44106, United States"
NCT02290925,The Effect of Biscuit Containing Kothala Himbutu on Blood Glucose in Patients With Diabetes. A Randomized Control Study,https://clinicaltrials.gov/study/NCT02290925,COMPLETED,YES,Type 2 Diabetes Mellitus,DRUG: Kothala Himbutu Biscuit|DIETARY_SUPPLEMENT: Placebo Biscuit,"Rajarata University, Sri Lanka",,ALL,"ADULT, OLDER_ADULT",133,OTHER,INTERVENTIONAL,"Allocation: RANDOMIZED|Intervention Model: CROSSOVER|Masking: QUADRUPLE (PARTICIPANT, CARE_PROVIDER, INVESTIGATOR, OUTCOMES_ASSESSOR)|Primary Purpose: TREATMENT",2014-05,2017-04,"Teaching Hospital Anuradhapura, Anuradhapura, North Central Province, 50000, Sri Lanka"
NCT06499311,Reflexology Versus Acupressure on Sleep Disturbance and Hot Flashes,https://clinicaltrials.gov/study/NCT06499311,RECRUITING,NO,Postmenopausal Flushing|Hot Flashes,OTHER: Foot Reflexology|OTHER: Acupressure,Cairo University,,FEMALE,ADULT,54,OTHER,INTERVENTIONAL,"Allocation: RANDOMIZED|Intervention Model: PARALLEL|Masking: QUADRUPLE (PARTICIPANT, CARE_PROVIDER, INVESTIGATOR, OUTCOMES_ASSESSOR)|Primary Purpose: TREATMENT",2024-07-01,2024-08-20,"Faculty of Physical Therapy, Giza, 02, Egypt"
NCT02531295,Immunologic Response to Kansui in Treated HIV+ Individuals: a Dose Escalation Study,https://clinicaltrials.gov/study/NCT02531295,TERMINATED,YES,HIV|Human Immunodeficiency Virus,DRUG: Euphorbia kansui extract powder prepared as tea,"University of California, San Francisco","University of Utah|amfAR, The Foundation for AIDS Research",ALL,"ADULT, OLDER_ADULT",5,OTHER,INTERVENTIONAL,Allocation: NON_RANDOMIZED|Intervention Model: SINGLE_GROUP|Masking: NONE|Primary Purpose: BASIC_SCIENCE,2019-05-15,2020-03-19,"University of Utah, Salt Lake City, Utah, 84132, United States"
NCT02526537,Gefitinib for EGFR Sensitive Mutation Postoperative Stage Ib NSCLC Patients,https://clinicaltrials.gov/study/NCT02526537,TERMINATED,NO,NSCLC,,Lunxu Liu,,ALL,"ADULT, OLDER_ADULT",10,OTHER,OBSERVATIONAL,Observational Model: |Time Perspective: p,2015-11-11,2016-06-07,"West China Hospital, ChengDu, Sichuan, China"
NCT05081583,Clinical Evaluation of the Pharmacokinetic Goldenseal-Metformin Interaction in Diabetic Patients,https://clinicaltrials.gov/study/NCT05081583,COMPLETED,YES,"Interaction, Adverse Herb-Drug|Diabetes Mellitus, Type 2",DRUG: Midazolam Hcl 1Mg/Ml Inj|DIETARY_SUPPLEMENT: Goldenseal (Hydrastis canadensis),Washington State University,National Center for Complementary and Integrative Health (NCCIH),ALL,"ADULT, OLDER_ADULT",22,OTHER,INTERVENTIONAL,Allocation: NON_RANDOMIZED|Intervention Model: CROSSOVER|Masking: NONE|Primary Purpose: BASIC_SCIENCE,2021-09-16,2023-08-31,"Washington State University College of Pharmacy and Pharmaceutical Sciences, Spokane, Washington, 99202, United States"
NCT05534152,Effect of Sumac on Appetite and Food Intake,https://clinicaltrials.gov/study/NCT05534152,COMPLETED,NO,Appetite|Food Intake,OTHER: sumac,Oxford Brookes University,,ALL,"ADULT, OLDER_ADULT",40,OTHER,INTERVENTIONAL,Allocation: RANDOMIZED|Intervention Model: PARALLEL|Masking: SINGLE (PARTICIPANT)|Primary Purpose: SUPPORTIVE_CARE,2018-11-01,2020-03-15,"Oxford Brookes Centre for Nutrition and Health, Oxford, OX3 0BP, United Kingdom"
NCT04766281,MLC901 in Moderate Traumatic Brain Injury,https://clinicaltrials.gov/study/NCT04766281,RECRUITING,NO,Moderate Traumatic Brain Injury,DIETARY_SUPPLEMENT: MLC901|GENETIC: Placebo,University of the Philippines,,ALL,"ADULT, OLDER_ADULT",120,OTHER,INTERVENTIONAL,"Allocation: RANDOMIZED|Intervention Model: PARALLEL|Masking: QUADRUPLE (PARTICIPANT, CARE_PROVIDER, INVESTIGATOR, OUTCOMES_ASSESSOR)|Primary Purpose: TREATMENT",2021-05-01,2024-07-31,"Mariano Marcos Memorial Hospital and Medical Center, Batac, Ilocos Norte, Philippines|Northern Mindanao Medical Center, Cagayan De Oro, Misamis Oriental, 9000, Philippines|Philippine General Hospital, Manila, 1000, Philippines"
NCT05109299,Antibacterial Effect of Miswak Toothpaste Compared to Fluoride Toothpaste,https://clinicaltrials.gov/study/NCT05109299,UNKNOWN,NO,Caries,OTHER: Miswak toothpaste|OTHER: Fluoride toothpaste,Cairo University,,ALL,ADULT,32,OTHER,INTERVENTIONAL,"Allocation: RANDOMIZED|Intervention Model: PARALLEL|Masking: DOUBLE (PARTICIPANT, OUTCOMES_ASSESSOR)|Primary Purpose: TREATMENT",2021-12-01,2022-04-30,"Faculty of Dentistry, Cairo University, Cairo, El Manial, 11553, Egypt"
NCT03617900,"Efficacy of Ginger Extract (Compare Between the Ginger Preparation of Ancient Concept of Thai Traditional Practitioner, Standard Drug and Placebo) by Using Pain Score to Evaluate After Pain of Three Groups of First Normal Postpartum Women.",https://clinicaltrials.gov/study/NCT03617900,COMPLETED,NO,Postpartum Disorder,DRUG: Ginger|DRUG: Placebo oral capsule|DRUG: Paracetamol,Thammasat University,,FEMALE,ADULT,99,OTHER,INTERVENTIONAL,"Allocation: RANDOMIZED|Intervention Model: PARALLEL|Masking: QUADRUPLE (PARTICIPANT, CARE_PROVIDER, INVESTIGATOR, OUTCOMES_ASSESSOR)|Primary Purpose: TREATMENT",2018-08-29,2019-05-25,"Naphatsaran Roekruangrit, Pathumthani, 12121, Thailand"
NCT04940117,Effects of the Eefooton on eGFR and QoL in Chronic Kidney Disease Patients.,https://clinicaltrials.gov/study/NCT04940117,COMPLETED,NO,Chronic Kidney Diseases,DIETARY_SUPPLEMENT: Eefooton oral solution,Kaohsiung Veterans General Hospital.,,ALL,"ADULT, OLDER_ADULT",100,OTHER,INTERVENTIONAL,Allocation: NA|Intervention Model: SINGLE_GROUP|Masking: NONE|Primary Purpose: TREATMENT,2021-07-01,2022-10-31,"WU SAM-CHIANG Medical clinic, Kaohsiung, 802, Taiwan"
NCT03468361,Diuretic Effect Evaluation of Petroselinum Crispum (Parsley) in Hypertensive Patients,https://clinicaltrials.gov/study/NCT03468361,WITHDRAWN,NO,Diurnal Enuresis|Hypertension,OTHER: Natural Product Petroselinum crispum (Parsley)|OTHER: Placebo,Universiti Sains Malaysia,Imam Abdulrahman Bin Faisal University,ALL,ADULT,0,OTHER,INTERVENTIONAL,"Allocation: RANDOMIZED|Intervention Model: PARALLEL|Masking: TRIPLE (PARTICIPANT, INVESTIGATOR, OUTCOMES_ASSESSOR)|Primary Purpose: TREATMENT",2018-03-01,2020-01-31,"College of Clinical Pharmacy, Dammam, Eastern Province, 31441, Saudi Arabia|FAMCO, Khobar, Eastern, 31441, Saudi Arabia"
NCT06732778,Effectiveness of Pain Neuroscience Education in Women With Menstrual Pain,https://clinicaltrials.gov/study/NCT06732778,RECRUITING,NO,Pain Management|Dysmenorrhea (Disorder),OTHER: Pain Neuroscience Education (PNE)|OTHER: Control Group (CG),Uskudar University,,FEMALE,"ADULT, OLDER_ADULT",74,OTHER,INTERVENTIONAL,"Allocation: RANDOMIZED|Intervention Model: PARALLEL|Masking: DOUBLE (PARTICIPANT, CARE_PROVIDER)|Primary Purpose: TREATMENT",2024-10-01,2025-02-01,"Uskudar University, Faculty of Health Sciences, Istanbul, 34000, Turkey"
NCT03709043,Addressing Heavy Alcohol Use Consumption With Kudzu,https://clinicaltrials.gov/study/NCT03709043,ACTIVE_NOT_RECRUITING,NO,Alcohol Use Disorder|Sexually Transmitted Diseases,DRUG: Standardized kudzu|OTHER: Placebo|DIAGNOSTIC_TEST: Sexually transmitted infection testing:|BEHAVIORAL: Medical Management (MM) counseling for alcohol use:|DIAGNOSTIC_TEST: Urinalysis for novel alcohol biochemical markers for recent alcohol use:|DIAGNOSTIC_TEST: Dried Blood Spot (DBS) Testing for PEth:|BEHAVIORAL: Behavioral survey measurements:|BEHAVIORAL: Ecological Momentary Assessment procedure:,Glenn-Milo Santos,National Institute on Alcohol Abuse and Alcoholism (NIAAA),ALL,"ADULT, OLDER_ADULT",120,OTHER,INTERVENTIONAL,"Allocation: RANDOMIZED|Intervention Model: PARALLEL|Masking: TRIPLE (PARTICIPANT, CARE_PROVIDER, INVESTIGATOR)|Primary Purpose: TREATMENT",2019-07-11,2024-06-30,"San Francisco Department of Public Health, San Francisco, California, 94102, United States"
NCT02337933,Effect of Ursolic Acid Administration on Insulin Sensitivity and Metabolic Syndrome,https://clinicaltrials.gov/study/NCT02337933,COMPLETED,YES,Metabolic Syndrome X,DRUG: Ursolic acid|DRUG: Placebo,University of Guadalajara,,ALL,ADULT,24,OTHER,INTERVENTIONAL,"Allocation: RANDOMIZED|Intervention Model: PARALLEL|Masking: DOUBLE (PARTICIPANT, INVESTIGATOR)|Primary Purpose: TREATMENT",2014-09,2015-09,"Instituto de Terapéutica Experimental y Clínica, Guadalajara, Jalisco, 44140, Mexico"
NCT06770491,A Phase 1 Study of Y-3 in US Healthy Volunteers.,https://clinicaltrials.gov/study/NCT06770491,NOT_YET_RECRUITING,NO,Safety|Tolerability|Pharmacokinetic Study in Healthy Volunteers,DRUG: Y-3 for injection|DRUG: Placebo,"Neurodawn Pharmaceutical Co., Ltd.",,ALL,ADULT,20,INDUSTRY,INTERVENTIONAL,"Allocation: RANDOMIZED|Intervention Model: SEQUENTIAL|Masking: QUADRUPLE (PARTICIPANT, CARE_PROVIDER, INVESTIGATOR, OUTCOMES_ASSESSOR)|Primary Purpose: OTHER",2025-01-06,2025-08-30,
