NCT Number,Study Title,Study URL,Study Status,Study Results,Conditions,Interventions,Sponsor,Collaborators,Sex,Age,Enrollment,Funder Type,Study Type,Study Design,Completion Date,Locations
NCT06693193,Personalized Virtual Environments for Managing Responsive Behaviors in Cognitively Impaired Patients: a Feasibility Study,https://clinicaltrials.gov/study/NCT06693193,NOT_YET_RECRUITING,NO,Cognitive Impairment|Dementia,DEVICE: Immersive Virtual Reality,Fondazione Bruno Kessler,,ALL,"ADULT, OLDER_ADULT",10,OTHER,INTERVENTIONAL,Allocation: NA|Intervention Model: SINGLE_GROUP|Masking: NONE|Primary Purpose: DEVICE_FEASIBILITY,2025-09,"APSP ''Grazioli'', Trento, 38123, Italy"
NCT06204562,Feasibility and Effects of Laughter-imitation Therapy (LIT),https://clinicaltrials.gov/study/NCT06204562,RECRUITING,NO,Aging Well,BEHAVIORAL: imitated laughter practice,The University of Hong Kong,,ALL,OLDER_ADULT,30,OTHER,INTERVENTIONAL,Allocation: RANDOMIZED|Intervention Model: PARALLEL|Masking: SINGLE (OUTCOMES_ASSESSOR)|Primary Purpose: PREVENTION,2026-01-31,"Community, Hong Kong, Hong Kong"
NCT02104349,Mindfulness Meditation for Spine Surgery Pain,https://clinicaltrials.gov/study/NCT02104349,SUSPENDED,NO,"Meditation|Spine Surgery|Pain, Postoperative",BEHAVIORAL: Mindfulness meditation,Icahn School of Medicine at Mount Sinai,,ALL,"ADULT, OLDER_ADULT",50,OTHER,INTERVENTIONAL,Allocation: RANDOMIZED|Intervention Model: PARALLEL|Masking: NONE|Primary Purpose: SUPPORTIVE_CARE,2024-07,"Icahn School of Medicine at Mount Sinai, New York, New York, 10029, United States"
NCT06786962,Virtual Reality Hypnosis and Nurses' Stress,https://clinicaltrials.gov/study/NCT06786962,ACTIVE_NOT_RECRUITING,NO,Hypnosis|Virtual Reality Therapy|Stress|Compassion Fatigue|Compassion Satisfaction|Emotions|Anxiety,DEVICE: Virtual reality Hypnosis|OTHER: Control arm (SEQ):,CARESP: Cellule d'animation régionale en soins palliatifs,University of Rennes 2,ALL,"ADULT, OLDER_ADULT",43,OTHER,INTERVENTIONAL,Allocation: RANDOMIZED|Intervention Model: PARALLEL|Masking: NONE|Primary Purpose: PREVENTION,2025-01,"RENNES, Rennes, Bretagne, 35000, France"
NCT02517723,Narrative Exposure Therapy in Women With Borderline Personality Disorder and Posttraumatic Stress Disorder,https://clinicaltrials.gov/study/NCT02517723,COMPLETED,NO,"Borderline Personality Disorder|Stress Disorders, Post-Traumatic",BEHAVIORAL: Narrative Exposure Therapy|BEHAVIORAL: Dialectical Behavior Therapy|BEHAVIORAL: Standard Inpatient Care|OTHER: Waiting List,Evangelisches Krankenhaus Bielefeld gGmbH,,FEMALE,"ADULT, OLDER_ADULT",67,OTHER,INTERVENTIONAL,Allocation: RANDOMIZED|Intervention Model: FACTORIAL|Masking: SINGLE (OUTCOMES_ASSESSOR)|Primary Purpose: TREATMENT,2020-01-31,"Clinic of Psychiatry, Evangelisches Krankenhaus Bielefeld, Bielefeld, 33617, Germany"
NCT02833870,Non-pharmacological Care of Alzheimer's Disease: Benefice of Musical Interventions,https://clinicaltrials.gov/study/NCT02833870,COMPLETED,NO,Alzheimer's Disease (AD) and Related Disorders,BEHAVIORAL: Musical intervention|BEHAVIORAL: Non-musical (cooking) intervention|BEHAVIORAL: Control with no intervention,CHU de Reims,,ALL,"ADULT, OLDER_ADULT",150,OTHER,INTERVENTIONAL,"Allocation: RANDOMIZED|Intervention Model: FACTORIAL|Masking: DOUBLE (CARE_PROVIDER, OUTCOMES_ASSESSOR)|Primary Purpose: SUPPORTIVE_CARE",2015-06,"Chu de Reims, Reims, 51092, France"
NCT05446194,"Vestibulopathy, Imbalance, and Gait Disturbances in Parkinson Disease",https://clinicaltrials.gov/study/NCT05446194,RECRUITING,NO,Parkinson Disease,DEVICE: Non invasive neuromodulation device pattern 1|DEVICE: Non invasive neuromodulation device pattern 2,University of Michigan,US Department of Veterans Affairs,ALL,"ADULT, OLDER_ADULT",64,OTHER,INTERVENTIONAL,"Allocation: RANDOMIZED|Intervention Model: PARALLEL|Masking: DOUBLE (PARTICIPANT, INVESTIGATOR)|Primary Purpose: TREATMENT",2025-05-31,"University of Michigan, Ann Arbor, Michigan, 48106, United States"
NCT01411514,Oral Prednisone Taper Versus Placebo for the Treatment of Acute Relapses in Multiple Sclerosis,https://clinicaltrials.gov/study/NCT01411514,TERMINATED,NO,Multiple Sclerosis,DRUG: Prednisone|DRUG: Placebo,Claudio Gobbi,"Ente Ospedaliero Cantonale, Ticino, Switzerland",ALL,"ADULT, OLDER_ADULT",27,OTHER_GOV,INTERVENTIONAL,"Allocation: RANDOMIZED|Intervention Model: PARALLEL|Masking: DOUBLE (PARTICIPANT, INVESTIGATOR)|Primary Purpose: TREATMENT",2015-01,"Osepdale Civico, Lugano, Ticino, 6903, Switzerland"
NCT03308630,Immediate Effect of Energy Alignment and Mantra on Stress Related Pain in Adolescents,https://clinicaltrials.gov/study/NCT03308630,COMPLETED,NO,Stress Related Disorder|Musculoskeletal Pain|Headache,BEHAVIORAL: Yoga based Energy Alignment and Mantra,NMP Medical Research Institute,Warwick Research Services|Hong Kong Academy of Yoga Therapy,ALL,"CHILD, ADULT",218,OTHER,INTERVENTIONAL,Allocation: NA|Intervention Model: SINGLE_GROUP|Masking: NONE|Primary Purpose: OTHER,2017-08-25,"NMP Medical Research Institute, Bikaner, Rajasthan, India"
NCT05340907,Patient Satisfaction and Tolerability Using Virtual Reality (VR) as Adjunctive Treatment During Flexible Bronchoscopy,https://clinicaltrials.gov/study/NCT05340907,COMPLETED,NO,Flexible Bronchoscopy,DEVICE: Virtual Reality Device,National University of Malaysia,,ALL,"ADULT, OLDER_ADULT",80,OTHER,INTERVENTIONAL,Allocation: RANDOMIZED|Intervention Model: SINGLE_GROUP|Masking: NONE|Primary Purpose: OTHER,2022-08-31,"University Kebangsaan Malaysia Medical Center, Bandar Tun Razak, Cheras, 56000, Malaysia|National University of Malaysia, Cheras, Kuala Lumpur, 50600, Malaysia|University Kebangsaan Malaysia Medical Centre, Cheras, Kuala Lumpur, 56000, Malaysia"
NCT06608706,The Key to Integrated Trauma Treatment in Psychosis Trial,https://clinicaltrials.gov/study/NCT06608706,RECRUITING,NO,"Psychiatric Diagnosis|Schizophrenia Disorders|Psychological Trauma, Historical",OTHER: Eye Movement Desensitization and Reprocessing (EMDR) for psychosis,Haukeland University Hospital,Helgelandssykehuset HF,ALL,"CHILD, ADULT, OLDER_ADULT",187,OTHER,INTERVENTIONAL,Allocation: RANDOMIZED|Intervention Model: PARALLEL|Masking: SINGLE (OUTCOMES_ASSESSOR)|Primary Purpose: TREATMENT,2028-12-31,"Haukeland University Hospital, Bergen, 5009, Norway|Helgeland Hospital HF, Sandnessjøen, 8800, Norway"
NCT05796869,The Effect of Laughter Therapy On The Food Craving,https://clinicaltrials.gov/study/NCT05796869,RECRUITING,NO,PMS|LAUGHTER|Food Habits,BEHAVIORAL: Assigned Interventions,Sinop University,,FEMALE,ADULT,90,OTHER,INTERVENTIONAL,"Allocation: NON_RANDOMIZED|Intervention Model: PARALLEL|Masking: DOUBLE (PARTICIPANT, INVESTIGATOR)|Primary Purpose: SUPPORTIVE_CARE",2024-01-30,"Sinop University, Sinop, 5700, Turkey"
NCT05214859,Enhancing Mother-Child Ties and Psychosocial Wellness Through Arts Among Children With Intellectual Disability and Their Mothers,https://clinicaltrials.gov/study/NCT05214859,RECRUITING,NO,Intellectual Disability|Mother-Child Relations,BEHAVIORAL: The Dyadic Expressive Arts Group Therapy,The University of Hong Kong,Hong Chi Association,ALL,"CHILD, ADULT, OLDER_ADULT",154,OTHER,INTERVENTIONAL,Allocation: RANDOMIZED|Intervention Model: PARALLEL|Masking: SINGLE (INVESTIGATOR)|Primary Purpose: TREATMENT,2025-12-31,"Centre on Behavioral Health HKU, Hong Kong, Hong Kong"
NCT06061588,"""Potential Effects of Virtual Reality Technology on the Treatment of Migraine-Type Headaches""",https://clinicaltrials.gov/study/NCT06061588,COMPLETED,NO,Migraine Disorders|Virtual Reality,DEVICE: Virtual Reality,Ankara City Hospital Bilkent,,ALL,"ADULT, OLDER_ADULT",140,OTHER,INTERVENTIONAL,"Allocation: NON_RANDOMIZED|Intervention Model: PARALLEL|Masking: DOUBLE (INVESTIGATOR, OUTCOMES_ASSESSOR)|Primary Purpose: TREATMENT",2024-03-10,"Ankara City Hospital, Ankara, 06800, Turkey"
NCT06732544,Effect of Multisensory (Snoezelen) Environment on Birth Outcomes,https://clinicaltrials.gov/study/NCT06732544,ACTIVE_NOT_RECRUITING,NO,Healthy,OTHER: snoezelen room|OTHER: routine delivery room,Amasya University,Ege University,FEMALE,ADULT,23,OTHER,INTERVENTIONAL,Allocation: RANDOMIZED|Intervention Model: PARALLEL|Masking: NONE|Primary Purpose: SUPPORTIVE_CARE,2025-04-30,"Amasya University Hospital, Amasya, 05100, Turkey"
NCT04689256,Pilot Randomized Controlled Study of the Impact of MedRhythms' MR-010 in Acute Stroke,https://clinicaltrials.gov/study/NCT04689256,TERMINATED,YES,"Stroke, Acute",DEVICE: MR-010,"University of Massachusetts, Worcester","MedRhythms, Inc.",ALL,"ADULT, OLDER_ADULT",4,OTHER,INTERVENTIONAL,Allocation: RANDOMIZED|Intervention Model: PARALLEL|Masking: NONE|Primary Purpose: TREATMENT,2023-01-30,"UMass Chan Medical School, Worcester, Massachusetts, 01655, United States"
NCT01239251,GlowCap Reminder System in Patients With Early Stage Breast Cancer Receiving Adjuvant Endocrine Therapy,https://clinicaltrials.gov/study/NCT01239251,TERMINATED,NO,Breast Cancer,OTHER: GlowCap device,Memorial Sloan Kettering Cancer Center,,FEMALE,"ADULT, OLDER_ADULT",8,OTHER,OBSERVATIONAL,Observational Model: |Time Perspective: p,2011-11,"Memorial Sloan Kettering Cancer Center 1275 York Avenue, New York, New York, 10065, United States"
NCT04069481,Dance for the Improvement of Balance and Gait After Stroke,https://clinicaltrials.gov/study/NCT04069481,UNKNOWN,NO,Chronic Stroke,OTHER: Dance|OTHER: Mindfulness meditation and Exercise,"University Health Network, Toronto",Heart and Stroke Foundation of Canada,ALL,"CHILD, ADULT, OLDER_ADULT",136,OTHER,INTERVENTIONAL,Allocation: RANDOMIZED|Intervention Model: PARALLEL|Masking: SINGLE (OUTCOMES_ASSESSOR)|Primary Purpose: TREATMENT,2021-12-31,"Toronto Rehabilitation Institute, Toronto, Ontario, M5G 2A2, Canada"
NCT06547671,Efficacy of a Sensory Comfort Room in Agitation Control,https://clinicaltrials.gov/study/NCT06547671,COMPLETED,NO,"Mental Disorders, Severe",OTHER: Employment of a confort room to help in anxiety and agitation moments.,Bioaraba Health Research Institute,,ALL,"CHILD, ADULT, OLDER_ADULT",62,NETWORK,INTERVENTIONAL,Allocation: NON_RANDOMIZED|Intervention Model: PARALLEL|Masking: NONE|Primary Purpose: TREATMENT,2023-05-01,"Araba University Hospital, Vitoria-gasteiz, Alava, Spain"
NCT05431556,Virtual Mind-Body Exercises for People Having Pancreatic Surgery,https://clinicaltrials.gov/study/NCT05431556,COMPLETED,NO,Pancreas Disease,OTHER: Virtual mind-body group exercise classes|OTHER: Enhanced usual care,Memorial Sloan Kettering Cancer Center,,ALL,"ADULT, OLDER_ADULT",29,OTHER,INTERVENTIONAL,Allocation: RANDOMIZED|Intervention Model: PARALLEL|Masking: NONE|Primary Purpose: SUPPORTIVE_CARE,2024-11-12,"Memorial Sloan Kettering Basking Ridge (Consent Only), Basking Ridge, New Jersey, 07920, United States|Memorial Sloan Kettering Monmouth (Consent Only), Middletown, New Jersey, 07748, United States|Memorial Sloan Kettering Bergen (Consent Only), Montvale, New Jersey, 07645, United States|Memorial Sloan Kettering Suffolk- Commack (Consent Only), Commack, New York, 11725, United States|Memorial Sloan Kettering Westchester (Consent Only), Harrison, New York, 10604, United States|Memorial Sloan Kettering Cancer Center (All Protocol Activities), New York, New York, 10065, United States|Memorial Sloan Kettering Nassau (Consent Only), Uniondale, New York, 11553, United States"
NCT02491645,Comparison of Effectiveness of Home Based Sensory Interventions Along With Standard Therapy Versus Standard Therapy Alone in Autistic Children With Sensory Processing Abnormalities,https://clinicaltrials.gov/study/NCT02491645,COMPLETED,NO,Autistic Children With Sensory Processing Abnormalities,OTHER: Sensory interventions,"Post Graduate Institute of Medical Education and Research, Chandigarh",,ALL,CHILD,40,OTHER,INTERVENTIONAL,Allocation: RANDOMIZED|Intervention Model: PARALLEL|Masking: NONE|Primary Purpose: SUPPORTIVE_CARE,2017-12,"Dr Hansashree P, Chandigarh, 160012, India"
NCT06182436,Virtual Reality for Pain Management During Dupilumab Injection,https://clinicaltrials.gov/study/NCT06182436,NOT_YET_RECRUITING,NO,Atopic Dermatitis|Pain|Anxiety,DEVICE: Virtual Reality Distraction|OTHER: Standard Treatment,St. Justine's Hospital,,ALL,CHILD,98,OTHER,INTERVENTIONAL,Allocation: RANDOMIZED|Intervention Model: CROSSOVER|Masking: NONE|Primary Purpose: TREATMENT,2025-03-15,"St. Justine's Hospital, Montréal, Quebec, H1T 3C5, Canada"
NCT04713345,VERARE_2 Efficacy of the Observation of Virtual Motor Actions for the Improvement of Gait in Patients With ICU-weakness,https://clinicaltrials.gov/study/NCT04713345,RECRUITING,NO,ICU-weakness,OTHER: Virtual Reality Observations|OTHER: Relaxation,Rennes University Hospital,"Equipe Hybrid, INRIA - Campus Universitaire de Beaulieu - F-35042 Rennes Cedex - France",ALL,"ADULT, OLDER_ADULT",66,OTHER,INTERVENTIONAL,Allocation: RANDOMIZED|Intervention Model: PARALLEL|Masking: NONE|Primary Purpose: SUPPORTIVE_CARE,2024-12-26,"Rennes University Hospital, Rennes, Bretagne, 35300, France"
NCT06064474,Effects of High Ventilation Breathwork With Retention (HVBR) on Health,https://clinicaltrials.gov/study/NCT06064474,COMPLETED,NO,Stress|Anxiety|Depressive Symptoms|Mental Wellbeing|Positive Affect|Negative Affect|Sleep-Related Impairment,BEHAVIORAL: High ventilation breathwork with retention (HVBR)|BEHAVIORAL: Placebo HVBR,University of Sussex,"Sylff Association|Brighton & Sussex Medical School|University of California, San Francisco",ALL,ADULT,200,OTHER,INTERVENTIONAL,Allocation: RANDOMIZED|Intervention Model: PARALLEL|Masking: SINGLE (PARTICIPANT)|Primary Purpose: TREATMENT,2023-12-11,"Prolific, Remote/Online, United Kingdom"
NCT06632691,Virtual Reality Headset and Acceptability of Rectosigmoidoscopy in Ulcerative Colitis: a Randomised Controlled Trial,https://clinicaltrials.gov/study/NCT06632691,RECRUITING,NO,Haemorrhagic Rectocolitis,DEVICE: Virtual reality headset,Centre Hospitalier Departemental Vendee,,ALL,"ADULT, OLDER_ADULT",100,OTHER,INTERVENTIONAL,Allocation: RANDOMIZED|Intervention Model: PARALLEL|Masking: NONE|Primary Purpose: SUPPORTIVE_CARE,2027-04-15,"Centre Hospitalier Departemental Vendee, La Roche Sur Yon, 85925, France|Centre Hospitalier Universitaire Nantes, Nantes, 44000, France"
NCT01876810,Initial Screening of Gemfibrozil as a Novel Treatment for Tobacco Addiction,https://clinicaltrials.gov/study/NCT01876810,COMPLETED,YES,Nicotine Dependence,DRUG: Gemfibrozil|DRUG: Placebo,Centre for Addiction and Mental Health,,ALL,"ADULT, OLDER_ADULT",28,OTHER,INTERVENTIONAL,"Allocation: RANDOMIZED|Intervention Model: CROSSOVER|Masking: DOUBLE (PARTICIPANT, INVESTIGATOR)|Primary Purpose: TREATMENT",2016-02,"Centre for Addiction and Mental Health, Toronto, Ontario, M5S 1S8, Canada|Centre of Addiction and Mental Health, Toronto, Ontario, M5S 2S1, Canada"
NCT04794608,Hypnosis in Virtual Reality in Patients in Protector Isolation Room for Aplasia in Clinical Hematology.,https://clinicaltrials.gov/study/NCT04794608,COMPLETED,NO,Aplasia,DEVICE: HYPNO VR® device,Hôpital Privé Sévigné,,ALL,"ADULT, OLDER_ADULT",60,OTHER,INTERVENTIONAL,Allocation: RANDOMIZED|Intervention Model: PARALLEL|Masking: NONE|Primary Purpose: SUPPORTIVE_CARE,2024-02-28,"Hôpital Privé Sévigné, Cesson-Sévigné, 35520, France"
NCT06750029,How Does Medical Clown Intervention Affect the Length of Hospitalization in Children With Pneumonia,https://clinicaltrials.gov/study/NCT06750029,COMPLETED,NO,Community-Acquired Pneumonia (CAP),OTHER: Medical clown visits,Carmel Medical Center,,ALL,"CHILD, ADULT",51,OTHER,INTERVENTIONAL,Allocation: NON_RANDOMIZED|Intervention Model: PARALLEL|Masking: SINGLE (CARE_PROVIDER)|Primary Purpose: SUPPORTIVE_CARE,2023-11-07,"Carmel Medical Center, Haifa, Israel"
NCT06443632,WASPE Sleep Adjustment for Children Aged 0-4 Years Undergoing Radiation Therapy,https://clinicaltrials.gov/study/NCT06443632,RECRUITING,NO,Pediatric Cancer,OTHER: Sleep Adjustment,Shandong Cancer Hospital and Institute,,ALL,CHILD,140,OTHER,INTERVENTIONAL,Allocation: RANDOMIZED|Intervention Model: PARALLEL|Masking: NONE|Primary Purpose: TREATMENT,2025-11-01,"Department of Radiation Oncology, Shandong Cancer Hospital and Institute, Jinan, Shandong, 0531, China"
NCT06244654,Anxiolytic Effectiveness of Virtual Reality Glasses in Surgery,https://clinicaltrials.gov/study/NCT06244654,COMPLETED,NO,Anesthesia|Anxiety|Postoperative Pain|Postoperative Recovery,DEVICE: Oculus Quest 2 VR virtual reality glasses and wired over-ear headphones|OTHER: No VR,Ankara City Hospital Bilkent,,ALL,"ADULT, OLDER_ADULT",86,OTHER,INTERVENTIONAL,Allocation: RANDOMIZED|Intervention Model: PARALLEL|Masking: SINGLE (OUTCOMES_ASSESSOR)|Primary Purpose: PREVENTION,2024-07-15,"Ankara City Hospital, Ankara, Cankaya, Turkey"
NCT03827187,Awareness Detection and Communication in Disorders of Consciousness,https://clinicaltrials.gov/study/NCT03827187,RECRUITING,NO,Disorder of Consciousness|Paralysis|Motor Neuron Disease|Stroke|Physical Disability,OTHER: Motor imagery based EEG-BCI,University of Ulster,"National Rehabilitation Hospital, Ireland|Belfast Health and Social Care Trust|Western Health and Social Care Trust|Southern Health and Social Care Trust|Northern Health and Social Care Trust|Barnsley Hospital NHS Foundation Trust|NHS Lothian|Walton Centre NHS Foundation Trust|Hull University Teaching Hospitals NHS Trust|Imperial College Healthcare NHS Trust|Royal Hospital for Neuro-disability|South Warwickshire NHS Foundation Trust|Sheffield Teaching Hospitals NHS Foundation Trust|Oxford University Hospitals NHS Trust|Castel Froma Neuro Care|Inspire Neurocare|The Huntercombe Group|Active Care Group",ALL,"CHILD, ADULT, OLDER_ADULT",30,OTHER,INTERVENTIONAL,Allocation: NA|Intervention Model: SINGLE_GROUP|Masking: NONE|Primary Purpose: BASIC_SCIENCE,2026-08,"National Rehabilitation Hospital of Ireland, Dublin, A96 E2H2, Ireland|Castel Froma Neuro Care, Warwick, Warwickshire, CV32 6LL, United Kingdom|Northern Health and Social Care Trust, Antrim, BT41 2RL, United Kingdom|Barnsley Hospital NHS Foundation Trust, Barnsley, S75 2EP, United Kingdom|Belfast Health and Social Care Trust, Belfast, BT9 7AB, United Kingdom|Frenchay Brain Injury Rehabilitation Centre, Bristol, BS16 2UU, United Kingdom|NHS Lothian, Edinburgh, EH9 2HL, United Kingdom|Hull University Teaching Hospitals NHS Trust, Hull, HU3 2JZ, United Kingdom|The Walton Centre NHS Foundation Trust, Liverpool, L9 7LJ, United Kingdom|Western Health and Social Care Trust, Londonderry, BT47 6SB, United Kingdom|The Huntercombe Group, London, SE10 8AD, United Kingdom|Royal Hospital for Neuro-Disability, London, SW15 3SW, United Kingdom|Imperial College Healthcare NHS Trust, London, W6 8RF, United Kingdom|Oxford University Hospitals NHS Foundation Trust, Oxford, OX3 7HE, United Kingdom|Southern Health and Social Care Trust, Portadown, BT63 5QQ, United Kingdom|Sheffield Teaching Hospitals NHS Foundation Trust, Sheffield, S10 2JF, United Kingdom|South Warwickshire NHS Foundation Trust, Warwick, CV34 5BW, United Kingdom|Inspire Neurocare Worcester, Worcester, WR2 6AS, United Kingdom"
NCT04538573,Virtual Reality MObility for Burn Patients,https://clinicaltrials.gov/study/NCT04538573,RECRUITING,NO,Pediatric Burns,DEVICE: Virtual Reality Distraction|DRUG: Standard Treatment,St. Justine's Hospital,,ALL,CHILD,20,OTHER,INTERVENTIONAL,Allocation: RANDOMIZED|Intervention Model: CROSSOVER|Masking: NONE|Primary Purpose: TREATMENT,2024-05-30,"St. Justine's Hospital, Montréal, Quebec, H1T 3C5, Canada"
NCT03962946,Distal Radius Fracture: Clinical Outcome After Conservative Treatment in the Elder Patient,https://clinicaltrials.gov/study/NCT03962946,COMPLETED,NO,Distal Radius Fracture,OTHER: Questionnaires to assess Patient reported Outcomes|OTHER: wrist function test,"University Hospital, Basel, Switzerland",,ALL,OLDER_ADULT,100,OTHER,OBSERVATIONAL,Observational Model: |Time Perspective: p,2018-10-18,"Department of Orthopaedics and Traumatology, University Hospital Basel, Basel, 4031, Switzerland"
NCT04573829,PsyDoMa : Non-drug Approaches at Home for Alzheimer's Patients With Psycho-behavioural Disorders,https://clinicaltrials.gov/study/NCT04573829,COMPLETED,NO,Behavioral Disorder,PROCEDURE: Home visit,Centre Hospitalier Universitaire de Nice,Fondation Mederic Alzheimer,ALL,OLDER_ADULT,40,OTHER,INTERVENTIONAL,Allocation: NA|Intervention Model: SINGLE_GROUP|Masking: NONE|Primary Purpose: HEALTH_SERVICES_RESEARCH,2022-09-19,"CHU de Nice, Nice, 06000, France"
NCT05927480,Audio Distraction for Traction Pin Placement,https://clinicaltrials.gov/study/NCT05927480,COMPLETED,YES,Lower Extremity Fracture,BEHAVIORAL: Audio distraction,HealthPartners Institute,Jackson Health System,ALL,"ADULT, OLDER_ADULT",54,OTHER,INTERVENTIONAL,Allocation: RANDOMIZED|Intervention Model: PARALLEL|Masking: NONE|Primary Purpose: SUPPORTIVE_CARE,2022-12-31,"Jackson Memorial Hospital, Miami, Florida, 33136, United States|Regions Hospital, Saint Paul, Minnesota, 55101, United States"
NCT04917211,Virtual Reality Mask During in Utero Surgical Procedures,https://clinicaltrials.gov/study/NCT04917211,UNKNOWN,NO,Fetofetal Transfusion|Analgesia,PROCEDURE: Virtual reality mask,Assistance Publique - Hôpitaux de Paris,,FEMALE,"ADULT, OLDER_ADULT",240,OTHER,INTERVENTIONAL,Allocation: NA|Intervention Model: SINGLE_GROUP|Masking: NONE|Primary Purpose: SUPPORTIVE_CARE,2024-12-01,"Hannane BOUCHGHOUL, Le Kremlin-Bicêtre, 94270, France"
NCT05326997,Treatment of Melasma With Yellow Light Compared to Tranexamic Acid,https://clinicaltrials.gov/study/NCT05326997,TERMINATED,NO,Melasma,DEVICE: Photobiomodulation group|OTHER: Group control (Tranexamic acid),University of Nove de Julho,,FEMALE,ADULT,21,OTHER,INTERVENTIONAL,"Allocation: RANDOMIZED|Intervention Model: PARALLEL|Masking: DOUBLE (PARTICIPANT, OUTCOMES_ASSESSOR)|Primary Purpose: TREATMENT",2023-10-30,"Galache Clinic, São Caetano Do Sul, São Paulo, 09550050, Brazil|Universidade Nove de Julho, São Paulo, 01504001, Brazil"
NCT05950789,Port Catheter Needle Insert: A Virtual Reality Application,https://clinicaltrials.gov/study/NCT05950789,COMPLETED,NO,Catheter Complications,OTHER: Virtual reality application,Izmir Bakircay University,,ALL,"ADULT, OLDER_ADULT",84,OTHER,INTERVENTIONAL,Allocation: RANDOMIZED|Intervention Model: PARALLEL|Masking: NONE|Primary Purpose: SUPPORTIVE_CARE,2023-06-10,"İzmir Bakırçay University, İzmir, 35665, Turkey"
NCT01129583,Botulinum Toxin as a Novel Treatment for Prevention of Post-Traumatic Elbow Stiffness,https://clinicaltrials.gov/study/NCT01129583,COMPLETED,YES,Post Traumatic Stiffness,DRUG: Botulinum Toxin Type A|DRUG: Saline,Columbia University,Allergan,ALL,"ADULT, OLDER_ADULT",18,OTHER,INTERVENTIONAL,"Allocation: RANDOMIZED|Intervention Model: PARALLEL|Masking: QUADRUPLE (PARTICIPANT, CARE_PROVIDER, INVESTIGATOR, OUTCOMES_ASSESSOR)|Primary Purpose: PREVENTION",2010-05,"Columbia University Medical Center, New York, New York, 10032, United States"
NCT05125029,Botulinum Toxin in Raynaud's Phenomenon,https://clinicaltrials.gov/study/NCT05125029,RECRUITING,NO,Raynaud Phenomenon,DRUG: Botulinum toxin,Emory University,American Society for Surgery of the Hand,ALL,"ADULT, OLDER_ADULT",36,OTHER,INTERVENTIONAL,"Allocation: RANDOMIZED|Intervention Model: PARALLEL|Masking: DOUBLE (PARTICIPANT, INVESTIGATOR)|Primary Purpose: TREATMENT",2025-12,"Emory University Hospital, Atlanta, Georgia, 30322, United States"
NCT04671485,Effectiveness of AutoHYpnosis in the Prevention of Anxiety During Radiotherapy of Head and Neck Tumors (HYMACO),https://clinicaltrials.gov/study/NCT04671485,COMPLETED,NO,Head and Neck Tumors,OTHER: Standard care|OTHER: Autohypnosis|OTHER: Musicotherapy,Institut de Cancérologie de Lorraine,,ALL,"ADULT, OLDER_ADULT",60,OTHER,INTERVENTIONAL,Allocation: RANDOMIZED|Intervention Model: PARALLEL|Masking: NONE|Primary Purpose: SUPPORTIVE_CARE,2024-12-11,"Institut de Cancérologie de Lorraine, Vandoeuvre les nancy, 54519, France|Institut de Cancérologie de Lorraine, Vandœuvre-lès-Nancy, Vandoeuvre lès Nancy, France"
NCT05875337,"The Effect of Acupressure on Procedural Pain, Anxiety and Hemodynamic Variables During Chest Tube Removal",https://clinicaltrials.gov/study/NCT05875337,RECRUITING,NO,"Pain, Postoperative|Anxiety|Hemodynamic Instability",OTHER: Acupressure|OTHER: Placebo acupressure,Mersin University,,ALL,"ADULT, OLDER_ADULT",68,OTHER,INTERVENTIONAL,"Allocation: RANDOMIZED|Intervention Model: PARALLEL|Masking: TRIPLE (PARTICIPANT, CARE_PROVIDER, OUTCOMES_ASSESSOR)|Primary Purpose: SUPPORTIVE_CARE",2024-12-25,"Mersin University Hospital, Mersin, Yenişehir, 33343, Turkey"
NCT04572425,Virtual Reality for Pain Management in Advanced Heart Failure,https://clinicaltrials.gov/study/NCT04572425,COMPLETED,NO,Heart Failure，Congestive|Acute Pain|Chronic Pain,OTHER: Guided imagery|OTHER: Virtual reality,Medstar Health Research Institute,,ALL,"ADULT, OLDER_ADULT",94,OTHER,INTERVENTIONAL,Allocation: RANDOMIZED|Intervention Model: PARALLEL|Masking: NONE|Primary Purpose: TREATMENT,2020-03-30,"MedStar Washington Hospital Center, Washington, District of Columbia, 20010, United States"
NCT06480409,**Virtual Reality in Student Mental Health: Solution or White Elephant?**,https://clinicaltrials.gov/study/NCT06480409,COMPLETED,NO,Mental Health Issue,OTHER: VR Mindfulness and Stress Reduction Program,The Opole University of Technology,,ALL,ADULT,50,OTHER,INTERVENTIONAL,Allocation: NA|Intervention Model: SINGLE_GROUP|Masking: NONE|Primary Purpose: PREVENTION,2024-06-05,"Faculty of Physical Education and Physiotherapy, Opole University of Technology, Opole, 45-758, Poland"
NCT03294031,Pilates as an Adjuvant Therapy in Parkinson Disease.,https://clinicaltrials.gov/study/NCT03294031,COMPLETED,NO,Parkinson Disease,OTHER: Pilates|OTHER: Conventional Exercise,University of Vigo,,ALL,"ADULT, OLDER_ADULT",15,OTHER,INTERVENTIONAL,Allocation: NON_RANDOMIZED|Intervention Model: SEQUENTIAL|Masking: NONE|Primary Purpose: SUPPORTIVE_CARE,2016-05-27,
