NCT Number,Study Title,Study URL,Study Status,Study Results,Conditions,Interventions,Sponsor,Collaborators,Sex,Age,Enrollment,Funder Type,Study Type,Study Design,Completion Date,Locations
NCT03306797,Music Therapy for Rehabilitation in Stroke Patients,https://clinicaltrials.gov/study/NCT03306797,COMPLETED,NO,Stroke|Hand Injuries,OTHER: STANDARD REHAB|DEVICE: SONICHAND,Istituti Clinici Scientifici Maugeri SpA,,ALL,"ADULT, OLDER_ADULT",65,OTHER,INTERVENTIONAL,Allocation: RANDOMIZED|Intervention Model: PARALLEL|Masking: SINGLE (OUTCOMES_ASSESSOR)|Primary Purpose: TREATMENT,2019-12-31,"ICS Maugeri, Nervi Institute, Genoa, Genova, Italy|ICS Maugeri, Montescano Institute, Montescano, Pavia, Italy|ICS Maugeri, Pavia Institute, Pavia, 27100, Italy|Fondazione Santa Lucia IRCCS, Rome, Italy"
NCT00448318,Evaluating the Effects of Music Interventions on Hospitalised People With Dementia,https://clinicaltrials.gov/study/NCT00448318,UNKNOWN,NO,"Dementia|Alzheimer's Disease|Dementia, Vascular|Lewy Body Disease",PROCEDURE: Music Therapy,"National Ageing Research Institute, Australia",,ALL,"ADULT, OLDER_ADULT",180,OTHER,INTERVENTIONAL,Allocation: RANDOMIZED|Intervention Model: PARALLEL|Masking: SINGLE|Primary Purpose: TREATMENT,2008-10,"National Ageing Research Institute, Parkville, Victoria, 3052, Australia"
NCT04268433,The MUSIC-HR Study,https://clinicaltrials.gov/study/NCT04268433,COMPLETED,NO,Musical Heart Rhythm Regulation|Cardiovascular Diseases|Heart Rate Control,OTHER: N/A - Non-interventional study,Chelsea and Westminster NHS Foundation Trust,CW+ Charity,ALL,"CHILD, ADULT, OLDER_ADULT",19,OTHER,OBSERVATIONAL,Observational Model: |Time Perspective: p,2019-09-30,"Chelsea and Westminster Hospital, London, Greater London, SW10 9NH, United Kingdom"
NCT06268158,The Effect of Eye Mask and Music on Sleep Quality and Delirium in Patients Monitored in Intensive Care Unit,https://clinicaltrials.gov/study/NCT06268158,COMPLETED,NO,Abdominal Surgery,BEHAVIORAL: Eye patch,TC Erciyes University,,ALL,"ADULT, OLDER_ADULT",45,OTHER,INTERVENTIONAL,Allocation: RANDOMIZED|Intervention Model: PARALLEL|Masking: NONE|Primary Purpose: PREVENTION,2024-04-01,"Erciyes University, Kayseri, Talas, 38080, Turkey"
NCT04293848,Effect of Vibroacoustic Therapy on Acute Stress in University Students,https://clinicaltrials.gov/study/NCT04293848,UNKNOWN,NO,"Stress, Psychologic",OTHER: Vibroacoustic therapy|OTHER: Only music (no vibrations),Palacky University,,ALL,ADULT,420,OTHER,INTERVENTIONAL,"Allocation: RANDOMIZED|Intervention Model: PARALLEL|Masking: TRIPLE (PARTICIPANT, INVESTIGATOR, OUTCOMES_ASSESSOR)|Primary Purpose: SUPPORTIVE_CARE",2022-12-30,"Faculty of Education, Palacký University Olomouc, Olomouc, 79900, Czechia"
NCT06326541,The Effect of Listening to the Holy Quran on Vital Signs in Coma Patients,https://clinicaltrials.gov/study/NCT06326541,COMPLETED,NO,Sequelae of; Complications Surgical and Medical Care,BEHAVIORAL: music therapy,Bitlis Eren University,,ALL,"CHILD, ADULT, OLDER_ADULT",72,OTHER,INTERVENTIONAL,Allocation: NA|Intervention Model: SINGLE_GROUP|Masking: NONE|Primary Purpose: SUPPORTIVE_CARE,2023-12-30,"Bitlis Eren University, Bitlis, 13100, Turkey"
NCT03316365,Long-term Training Effects of Rhythmic Auditory Stimulation on Gait in Patients With Parkinson's Disease,https://clinicaltrials.gov/study/NCT03316365,COMPLETED,NO,Continuous Rhythmic Auditory Stimulation|Intermittent Rhythmic Auditory Stimulation,OTHER: Rhythmic Auditory Stimulation (RAS),University of Toronto,Poudre Valley Health System Fort Collins CO|Colorado State University,ALL,"ADULT, OLDER_ADULT",60,OTHER,INTERVENTIONAL,"Allocation: RANDOMIZED|Intervention Model: PARALLEL|Masking: DOUBLE (CARE_PROVIDER, OUTCOMES_ASSESSOR)|Primary Purpose: TREATMENT",2011-08,
NCT02261558,Effects of Clinical Music Improvisation on Resiliency in Adults Undergoing Infusion Therapy,https://clinicaltrials.gov/study/NCT02261558,COMPLETED,NO,Anxiety,OTHER: Clinical Improvisation Instrumental Music Therapy|OTHER: Clinical Vocal Improvisation,Beth Israel Medical Center,,ALL,"ADULT, OLDER_ADULT",176,OTHER,INTERVENTIONAL,"Allocation: RANDOMIZED|Intervention Model: PARALLEL|Masking: TRIPLE (PARTICIPANT, INVESTIGATOR, OUTCOMES_ASSESSOR)|Primary Purpose: SUPPORTIVE_CARE",2019-04-01,"Beth Israel Medical Center, New York, New York, 10003, United States"
NCT04777266,Music Therapy for People With Schizophrenia and Relates Psychosis.,https://clinicaltrials.gov/study/NCT04777266,COMPLETED,NO,Schizophrenia; Psychosis,BEHAVIORAL: Music therapy and treatment as usual,State reference center for psychosocial care,University of Valencia,ALL,"ADULT, OLDER_ADULT",60,OTHER_GOV,INTERVENTIONAL,Allocation: RANDOMIZED|Intervention Model: PARALLEL|Masking: SINGLE (OUTCOMES_ASSESSOR)|Primary Purpose: TREATMENT,2019-04-30,"Sergio Lacamara Cano, Valencia, 46015, Spain"
NCT04442035,5-element Music Therapy on Patients With Breast Cancer,https://clinicaltrials.gov/study/NCT04442035,COMPLETED,NO,"Breast Cancer Female|Quality of Life|Depression, Anxiety",BEHAVIORAL: 5-element music therapy,Guangzhou University of Traditional Chinese Medicine,,FEMALE,"ADULT, OLDER_ADULT",64,OTHER,INTERVENTIONAL,Allocation: RANDOMIZED|Intervention Model: PARALLEL|Masking: SINGLE (OUTCOMES_ASSESSOR)|Primary Purpose: TREATMENT,2018-06-03,"Guangdong Provincial Chinese medicine hospital, Guangzhou, Guangdong, 510000, China"
NCT06817330,The Effect of a Music Intervention on Postictal Agitation in Electroconvulsive Therapy Patients,https://clinicaltrials.gov/study/NCT06817330,NOT_YET_RECRUITING,NO,Music Intervention|Electroconvulsive Therapy Treated Patients|Agitation on Recovery from Sedation,"OTHER: Intervention group, listening to recorded music|OTHER: Control group, headphones with no music",Erasmus Medical Center,Parnassia Groep,ALL,"ADULT, OLDER_ADULT",92,OTHER,INTERVENTIONAL,Allocation: RANDOMIZED|Intervention Model: PARALLEL|Masking: NONE|Primary Purpose: TREATMENT,2027-02-28,"Erasmus Medical Center, Rotterdam, 3015 GD, Netherlands|Antes Parnassia Group, Rotterdam, 3079 DC, Netherlands"
NCT00824681,Effect of Music Therapy on Families of Burn Patients,https://clinicaltrials.gov/study/NCT00824681,TERMINATED,NO,Burns,BEHAVIORAL: Sound Of Family Together (S.O.F.T.) Music Program|OTHER: Non-Therapy Related Activities (NTRA),MetroHealth Medical Center,The Cleveland Music School Settlement|Kulas Foundation,ALL,CHILD,30,OTHER,INTERVENTIONAL,Allocation: RANDOMIZED|Intervention Model: CROSSOVER|Masking: NONE|Primary Purpose: SUPPORTIVE_CARE,2010-07,"MetroHealth Medical Center, Cleveland, Ohio, 44109, United States"
NCT04761497,Effects of Group Music Therapy Interventions on Alzheimer's Disease Patients: a Three-arm Randomized Controlled Blind Study.,https://clinicaltrials.gov/study/NCT04761497,COMPLETED,NO,Alzheimer's Disease,OTHER: Actice music therapy|OTHER: Watching nature videos|OTHER: Passive music therapy,Universidad Católica San Antonio de Murcia,,ALL,"CHILD, ADULT, OLDER_ADULT",90,OTHER,INTERVENTIONAL,"Allocation: RANDOMIZED|Intervention Model: PARALLEL|Masking: DOUBLE (PARTICIPANT, INVESTIGATOR)|Primary Purpose: TREATMENT",2019-01-07,"UCMurcia, Murcia, 30107, Spain"
NCT03709225,Mindfulness-Music Intervention for Adolescents and Young Adults With Cancer,https://clinicaltrials.gov/study/NCT03709225,COMPLETED,NO,Anxiety|Oncology|Stress,BEHAVIORAL: Music-based meditation,Dana-Farber Cancer Institute,,ALL,"CHILD, ADULT",38,OTHER,INTERVENTIONAL,Allocation: NA|Intervention Model: SINGLE_GROUP|Masking: NONE|Primary Purpose: SUPPORTIVE_CARE,2021-04-05,"Dana Farber Cancer Institute, Boston, Massachusetts, 02215, United States"
NCT06219148,Music Therapy and Social Work Telehealth for Older Adult Well-Being,https://clinicaltrials.gov/study/NCT06219148,RECRUITING,NO,Aging Well|Dementia|Telemedicine,BEHAVIORAL: Music Therapy Telehealth|BEHAVIORAL: Non-Collaborative Social Work Telehealth|BEHAVIORAL: Collaborative Social Work Telehealth,"Alaine E Hernandez, PhD",American Music Therapy Association,ALL,OLDER_ADULT,20,OTHER,INTERVENTIONAL,"Allocation: RANDOMIZED|Intervention Model: PARALLEL|Masking: DOUBLE (PARTICIPANT, INVESTIGATOR)|Primary Purpose: HEALTH_SERVICES_RESEARCH",2025-06-30,"University of Kentucky, Lexington, Kentucky, 40506, United States|Saint Louis University, Saint Louis, Missouri, 63103, United States"
NCT06120660,Musical Intervention on Stress Effects in Critically Ill Patients,https://clinicaltrials.gov/study/NCT06120660,RECRUITING,NO,"Critical Care|Respiration, Artificial|Sedation",OTHER: Music Therapy,University of Oviedo,Sociedad Española de Enfermería Intensiva y Unidades Coronarias,ALL,"ADULT, OLDER_ADULT",200,OTHER,INTERVENTIONAL,"Allocation: RANDOMIZED|Intervention Model: PARALLEL|Masking: DOUBLE (PARTICIPANT, CARE_PROVIDER)|Primary Purpose: SUPPORTIVE_CARE",2025-12-31,"Hospital Universitario Central de Asturias, Oviedo, Asturias, 33011, Spain"
NCT04573101,EEG Responses to Arabic Music Scales,https://clinicaltrials.gov/study/NCT04573101,COMPLETED,NO,Healthy,OTHER: Music listening / EEG recording,Weill Cornell Medical College in Qatar,,ALL,"ADULT, OLDER_ADULT",42,OTHER,INTERVENTIONAL,Allocation: RANDOMIZED|Intervention Model: CROSSOVER|Masking: NONE|Primary Purpose: BASIC_SCIENCE,2022-09-20,"Ghizlane Bendriss, Doha, 24144, Qatar"
NCT03653130,Participatory Music Program for Homeless Veterans,https://clinicaltrials.gov/study/NCT03653130,COMPLETED,NO,Quality of Life,BEHAVIORAL: Crossroads Orchestra Participatory Music Program,VA Quality Enhancement Research Intiative,,ALL,"ADULT, OLDER_ADULT",180,OTHER,INTERVENTIONAL,Allocation: NON_RANDOMIZED|Intervention Model: PARALLEL|Masking: NONE|Primary Purpose: TREATMENT,2019-06-18,"VA Domiciliary, Indianapolis, Indiana, 46216, United States"
NCT03645811,Integrative Medicine on Exam Anxiety,https://clinicaltrials.gov/study/NCT03645811,COMPLETED,YES,Anxiety|Educational Problems,BEHAVIORAL: Music Therapy|BEHAVIORAL: EFT,Istanbul Saglik Bilimleri University,,ALL,ADULT,96,OTHER,INTERVENTIONAL,Allocation: RANDOMIZED|Intervention Model: PARALLEL|Masking: SINGLE (PARTICIPANT)|Primary Purpose: SUPPORTIVE_CARE,2018-05-14,"Medipol Universtiy, Istanbul, 34668, Turkey"
NCT06083519,Assessment of a Novel Sound-based Treatment for Managing Distress Related to Tinnitus,https://clinicaltrials.gov/study/NCT06083519,NOT_YET_RECRUITING,NO,Tinnitus,BEHAVIORAL: White Noise|BEHAVIORAL: Music and Auditory Beat Stimulation,Toronto Metropolitan University,"Lucid, Inc.|Sonova Canada Inc.|Mitacs",ALL,"ADULT, OLDER_ADULT",50,OTHER,INTERVENTIONAL,Allocation: RANDOMIZED|Intervention Model: CROSSOVER|Masking: NONE|Primary Purpose: SUPPORTIVE_CARE,2024-08-31,"Toronto Metropolitan University, Toronto, Ontario, M5B 2K3, Canada"
NCT06798155,Effect of Listening to Standardized Music Sequences on Preventing Postoperative Pain in Proctologic Surgery,https://clinicaltrials.gov/study/NCT06798155,NOT_YET_RECRUITING,NO,Hemorrhoid|Anal Fistulas|MUSICAL THERAPY|Anal Fissure and Fistula,OTHER: Standardized Music Listening Therapy,Clinique Saint-Vincent,,ALL,"ADULT, OLDER_ADULT",550,OTHER,INTERVENTIONAL,Allocation: RANDOMIZED|Intervention Model: PARALLEL|Masking: NONE|Primary Purpose: SUPPORTIVE_CARE,2027-07,"Clinique Saint Vincent, Saint Denis, 97404, Réunion"
NCT03432247,Pain Management Support Study for Patients With Advanced Cancer,https://clinicaltrials.gov/study/NCT03432247,COMPLETED,NO,Advanced Cancer,BEHAVIORAL: Interactive Music Therapy|BEHAVIORAL: Verbal support,Drexel University,National Institute of Nursing Research (NINR),ALL,"ADULT, OLDER_ADULT",103,OTHER,INTERVENTIONAL,Allocation: RANDOMIZED|Intervention Model: PARALLEL|Masking: NONE|Primary Purpose: SUPPORTIVE_CARE,2021-12-31,"Hahnemann University Hospital, Philadelphia, Pennsylvania, 19102, United States|Thomas Jefferson Sidney Kimmel Cancer Center, Philadelphia, Pennsylvania, 19107, United States|Cancer Treatment Centers of America (CTCA), Philadelphia, Pennsylvania, 19124, United States"
NCT05320783,Effect on Music Therapy on Quality of Recovery After Gynecological Laparoscopy,https://clinicaltrials.gov/study/NCT05320783,COMPLETED,NO,Quality of Recovery After General Anesthesia|Post Operative Pain,OTHER: music|OTHER: control,Eun Kyung Choi,,FEMALE,"ADULT, OLDER_ADULT",82,OTHER,INTERVENTIONAL,"Allocation: RANDOMIZED|Intervention Model: PARALLEL|Masking: TRIPLE (PARTICIPANT, INVESTIGATOR, OUTCOMES_ASSESSOR)|Primary Purpose: PREVENTION",2022-03-16,"Eun kyung Choi, Daegu, Korea (the Republic Of), 41944, Korea, Republic of"
NCT06577324,Music Therapy on State Anxiety Levels and Well-being During Chemotherapy,https://clinicaltrials.gov/study/NCT06577324,NOT_YET_RECRUITING,NO,"Anxiety State|Well-Being, Psychological",BEHAVIORAL: Live group music therapy,Claudia Aristizábal,SONO|keralty|Clinica El Carmen|Clínica Sebastián de Belalcazar,ALL,"ADULT, OLDER_ADULT",102,OTHER,INTERVENTIONAL,Allocation: RANDOMIZED|Intervention Model: PARALLEL|Masking: NONE|Primary Purpose: TREATMENT,2025-09-01,"Clínica Colsanitas, Bogotá, Bogotá D.C., Colombia"
NCT05735860,The Application of Virtual Reality Exposure Versus Relaxation Training in Music Performance Anxiety,https://clinicaltrials.gov/study/NCT05735860,UNKNOWN,NO,Music Performance Anxiety,BEHAVIORAL: Virtual Reality Exposure Therapy (VRET)|BEHAVIORAL: Progressive Muscle Relaxation (PMR),Wuerzburg University Hospital,,ALL,ADULT,46,OTHER,INTERVENTIONAL,Allocation: RANDOMIZED|Intervention Model: PARALLEL|Masking: SINGLE (PARTICIPANT)|Primary Purpose: TREATMENT,2024-03-01,"Department of Psychiatry, Psychosomatics, and Psychotherapy, Center for Mental Health, University Hospital of Wuerzburg, Würzburg, 97080, Germany"
NCT03642002,The Effects of Music Therapy on Adult Patients Requiring Mechanical Ventilation in the ICU,https://clinicaltrials.gov/study/NCT03642002,RECRUITING,NO,Acute Respiratory Distress Syndrome|Acute Hypoxemic Respiratory Failure|Acute Hypercapnic Respiratory Failure,OTHER: Toning|OTHER: Ocean drum & SOK melody|OTHER: SOK|BEHAVIORAL: Process|OTHER: Holding Harmonic Container,Icahn School of Medicine at Mount Sinai,,ALL,"ADULT, OLDER_ADULT",178,OTHER,INTERVENTIONAL,Allocation: RANDOMIZED|Intervention Model: PARALLEL|Masking: NONE|Primary Purpose: SUPPORTIVE_CARE,2025-09,"Mount Sinai West, New York, New York, 10019, United States|Houston Methodist Hospital, Houston, Texas, 77030, United States"
NCT05077306,Receptive Music Therapy on Anxiety and Vital Parameters in Hospitalized Covid-19 Patients.,https://clinicaltrials.gov/study/NCT05077306,COMPLETED,NO,SARS-CoV2 Infection,OTHER: music therapy group,Azienda Ospedaliero-Universitaria Consorziale Policlinico di Bari,,ALL,"ADULT, OLDER_ADULT",40,OTHER,INTERVENTIONAL,Allocation: RANDOMIZED|Intervention Model: PARALLEL|Masking: NONE|Primary Purpose: SUPPORTIVE_CARE,2021-06-30,"AOUC Policlinico di Bari, Bari, 70124, Italy"
NCT06800144,Effect of Music Therapy on Pain in People with Multiple Sclerosis,https://clinicaltrials.gov/study/NCT06800144,NOT_YET_RECRUITING,NO,"Multiple Sclerosis, MS",BEHAVIORAL: Heart rate synchronized motor imagery music therapy|BEHAVIORAL: Heart rate synchronized music therapy,Istanbul Bilgi University,,ALL,"ADULT, OLDER_ADULT",45,OTHER,INTERVENTIONAL,Allocation: RANDOMIZED|Intervention Model: PARALLEL|Masking: SINGLE (OUTCOMES_ASSESSOR)|Primary Purpose: TREATMENT,2027-12-01,
NCT05015140,Effects of Music Therapy on Sleep Quality in Patients Who Had Hematopoietic Stem Cell Transplantation,https://clinicaltrials.gov/study/NCT05015140,COMPLETED,NO,Hematologic Diseases,OTHER: musıc therapy,Istanbul University - Cerrahpasa,,ALL,"ADULT, OLDER_ADULT",31,OTHER,INTERVENTIONAL,Allocation: RANDOMIZED|Intervention Model: SEQUENTIAL|Masking: NONE|Primary Purpose: OTHER,2021-05-31,"İstanbul University- Cerrahpaşa, Istanbul, 34098, Turkey|Istanbul University-Cerrahpasa, Istanbul, 34098, Turkey"
NCT05317910,Effect of Music Therapy on Anxiety of Caregivers of Alzheimer's Disease Patients,https://clinicaltrials.gov/study/NCT05317910,COMPLETED,NO,Alzheimer Disease,OTHER: MUSIC CARE,Association de Musicothérapie Applications et Recherches Cliniques,,ALL,"ADULT, OLDER_ADULT",26,OTHER,INTERVENTIONAL,Allocation: NA|Intervention Model: SINGLE_GROUP|Masking: NONE|Primary Purpose: TREATMENT,2022-07-20,"Sainte-Marie Hospital, Paris, 75014, France"
NCT04840173,Beyond Listening: A Music-based Intervention,https://clinicaltrials.gov/study/NCT04840173,UNKNOWN,NO,Alzheimer's Disease (Incl Subtypes)|Depressive Symptoms,BEHAVIORAL: Music,MJHS Institute for Innovation in Palliative Care,Alzheimer's Association,FEMALE,"CHILD, ADULT, OLDER_ADULT",60,OTHER,INTERVENTIONAL,Allocation: NA|Intervention Model: SINGLE_GROUP|Masking: NONE|Primary Purpose: TREATMENT,2023-07-01,"Menorah Center for Nursing and Rehabilitation, Brooklyn, New York, 11235, United States"
NCT03593551,Effects of Different Relaxation Interventions on Reducing Stress in Chinese Breastfeeding Mothers,https://clinicaltrials.gov/study/NCT03593551,COMPLETED,NO,Stress-related Problem|Breastfeeding|Relaxation Therapy|Psychological Stress,COMBINATION_PRODUCT: five relaxation treatments and one control,"University College, London",,FEMALE,ADULT,20,OTHER,INTERVENTIONAL,Allocation: |Intervention Model: SEQUENTIAL|Masking: NONE|Primary Purpose: TREATMENT,2018-06-28,"Beijing Children Hospital, Beijing, 100045, China"
NCT00082303,Music Imagery for Patients Receiving Chemotherapy for Leukemia or Non-Hodgkin's Lymphoma,https://clinicaltrials.gov/study/NCT00082303,COMPLETED,NO,"Leukemia|Lymphoma, Non-Hodgkin",BEHAVIORAL: Music Imagery,National Center for Complementary and Integrative Health (NCCIH),,ALL,"ADULT, OLDER_ADULT",60,NIH,INTERVENTIONAL,Allocation: RANDOMIZED|Intervention Model: PARALLEL|Masking: NONE|Primary Purpose: TREATMENT,,"Indiana University Cancer Center/University Hospital, Indianapolis, Indiana, 46202, United States"
NCT06804304,Efficacy of Music-Based Telerehabilitation After Stroke,https://clinicaltrials.gov/study/NCT06804304,NOT_YET_RECRUITING,NO,Stroke,BEHAVIORAL: Music-based telerehabilitation,Teppo Sarkamo,HUS Neurocenter|HUS Medical Imaging Centre|University of Jyvaskyla|Finnish Brain Association|Uusimaa Stroke Association,ALL,"ADULT, OLDER_ADULT",100,OTHER,INTERVENTIONAL,Allocation: RANDOMIZED|Intervention Model: PARALLEL|Masking: SINGLE (OUTCOMES_ASSESSOR)|Primary Purpose: TREATMENT,2028-12,"University of Helsinki / Faculty of Medicine / Department of Psychology, Helsinki, 00014, Finland"
NCT05945264,Music Intervention for Preterm Birth,https://clinicaltrials.gov/study/NCT05945264,RECRUITING,NO,Preterm Birth,BEHAVIORAL: Music Intervention (MI)|OTHER: Sham Control (SC),Columbia University,National Institute on Minority Health and Health Disparities (NIMHD)|Emory University|Icahn School of Medicine at Mount Sinai,FEMALE,ADULT,142,OTHER,INTERVENTIONAL,Allocation: RANDOMIZED|Intervention Model: PARALLEL|Masking: SINGLE (OUTCOMES_ASSESSOR)|Primary Purpose: PREVENTION,2026-08-29,"Louis Armstrong Center for Music and Medicine at Mount Sinai Health System, New York, New York, 10003, United States|Columbia University Irving Medical Center/NYP, New York, New York, 10032, United States"
NCT02854085,Art Therapy and Music Reminiscence Activity in the Prevention of Cognitive Decline,https://clinicaltrials.gov/study/NCT02854085,COMPLETED,NO,Mild Cognitive Impairment,BEHAVIORAL: Art Therapy|BEHAVIORAL: Music Reminiscence Activity,National University of Singapore,,ALL,"ADULT, OLDER_ADULT",68,OTHER,INTERVENTIONAL,Allocation: RANDOMIZED|Intervention Model: PARALLEL|Masking: SINGLE (OUTCOMES_ASSESSOR)|Primary Purpose: PREVENTION,2017-05,"Training and Research Academy, Singapore, 648886, Singapore"
NCT04911673,Effectiveness of Dark Chocolate and Music in Dysmenorrhea,https://clinicaltrials.gov/study/NCT04911673,COMPLETED,NO,Pain|Primary Dysmenorrhea|Menstrual Pain,BEHAVIORAL: music|DIETARY_SUPPLEMENT: Chocolate group,Celal Bayar University,,FEMALE,ADULT,84,OTHER,INTERVENTIONAL,"Allocation: RANDOMIZED|Intervention Model: PARALLEL|Masking: DOUBLE (PARTICIPANT, INVESTIGATOR)|Primary Purpose: PREVENTION",2021-12-30,"Ebru Baysal, Manisa, Turkey"
NCT02394938,Effects of Recorded Music in Heart Failure Patients,https://clinicaltrials.gov/study/NCT02394938,COMPLETED,NO,Heart Diseases,OTHER: MUSIC,Azienda Usl di Bologna,,ALL,"ADULT, OLDER_ADULT",150,OTHER_GOV,INTERVENTIONAL,Allocation: RANDOMIZED|Intervention Model: PARALLEL|Masking: SINGLE (OUTCOMES_ASSESSOR)|Primary Purpose: TREATMENT,2015-12,"Francesco Burrai, Bologna, 40124, Italy"
NCT03269929,Comparison Between Efficacy of Music Therapy and Intravenous Midazolam 0.02 mg/kgBW in Reducing Preoperative Anxiety,https://clinicaltrials.gov/study/NCT03269929,COMPLETED,NO,Cancer,OTHER: Music therapy|DRUG: Midazolam,Indonesia University,,FEMALE,"ADULT, OLDER_ADULT",60,OTHER,INTERVENTIONAL,"Allocation: RANDOMIZED|Intervention Model: PARALLEL|Masking: QUADRUPLE (PARTICIPANT, CARE_PROVIDER, INVESTIGATOR, OUTCOMES_ASSESSOR)|Primary Purpose: SUPPORTIVE_CARE",2017-07-01,"Cipto Mangunkusumo Central National Hospital, Central Jakarta, DKI Jakarta, 10430, Indonesia"
NCT05508646,Group-Based Telehealth Music Therapy Intervention for Patients With Dementia: A Pilot Study,https://clinicaltrials.gov/study/NCT05508646,COMPLETED,NO,Behavioral and Psychiatric Symptoms of Dementia|Alzheimer Disease|Lewy Body Disease|Frontotemporal Dementia,BEHAVIORAL: Music therapy intervention|BEHAVIORAL: Personalized music CD,Geisinger Clinic,,ALL,"ADULT, OLDER_ADULT",48,OTHER,INTERVENTIONAL,Allocation: RANDOMIZED|Intervention Model: PARALLEL|Masking: NONE|Primary Purpose: SUPPORTIVE_CARE,2024-01-29,"Maya Lichtenstein, Wilkes-Barre, Pennsylvania, 18702, United States"
NCT04484935,"Evaluate the Safety and Tolerability, for Nirsevimab in Immunocompromised Children",https://clinicaltrials.gov/study/NCT04484935,COMPLETED,YES,RSV Infection,DRUG: Nirsevimab,AstraZeneca,Iqvia Pty Ltd,ALL,CHILD,100,INDUSTRY,INTERVENTIONAL,Allocation: NA|Intervention Model: SINGLE_GROUP|Masking: NONE|Primary Purpose: PREVENTION,2023-02-17,"Research Site, Los Angeles, California, 90027, United States|Research Site, Tampa, Florida, 33606, United States|Research Site, Syracuse, New York, 13210, United States|Research Site, North Charleston, South Carolina, 29406, United States|Research Site, Memphis, Tennessee, 38105, United States|Research Site, Fort Worth, Texas, 76104, United States|Research Site, Tacoma, Washington, 98405, United States|Research Site, Bruxelles, 1200, Belgium|Research Site, Liège, 4000, Belgium|Research Site, Bunkyo-ku, 113-8519, Japan|Research Site, Fuchu-shi, 183-8561, Japan|Research Site, Kawasaki-shi, 216-8511, Japan|Research Site, Kurume-shi, 830-0011, Japan|Research Site, Kyoto-shi, 606-8507, Japan|Research Site, Nagasaki-shi, 852-8501, Japan|Research Site, Setagaya-ku, 157-8535, Japan|Research Site, Tsukuba-shi, 305-8576, Japan|Research Site, Yokohama-shi, 232 8555, Japan|Research Site, Bydgoszcz, 85-048, Poland|Research Site, Parktown, 2193, South Africa|Research Site, Soweto, 2013, South Africa|Research Site, Barcelona, 8035, Spain|Research Site, Granada, 18014, Spain|Research Site, Madrid, 28041, Spain|Research Site, Madrid, 28046, Spain|Research Site, Dnipro, 49006, Ukraine|Research Site, Kharkiv, 61075, Ukraine|Research Site, Nottingham, NG7 2UH, United Kingdom"
NCT05603533,Adherence by Music to Exercise in Dementia: Group Therapy,https://clinicaltrials.gov/study/NCT05603533,RECRUITING,NO,Dementia,OTHER: Music and video-based group exercise therapy,Hasselt University,Stichting Alzheimer Onderzoek,ALL,OLDER_ADULT,75,OTHER,INTERVENTIONAL,Allocation: RANDOMIZED|Intervention Model: PARALLEL|Masking: SINGLE (OUTCOMES_ASSESSOR)|Primary Purpose: TREATMENT,2025-09,"Aquamarijn, Kasterlee, Antwerpen, 2460, Belgium|Woonzorgcentrum Beversthuis, Beverst, Limburg, 3740, Belgium|Woonzorgcentrum St.Elisabeth, Hasselt, Limburg, 3500, Belgium|Woonzorgcentrum Kimpenhof, Opglabbeek, Limburg, 3660, Belgium"
NCT00772226,The Use of Music as Pain Therapy in Patients Undergoing Laparoscopic Cholecystectomy in a Day Care Unit,https://clinicaltrials.gov/study/NCT00772226,COMPLETED,NO,Pain|Ponv|Fatigue,DEVICE: music pillow|DEVICE: pillow without music,Randers Regional Hospital,,ALL,"ADULT, OLDER_ADULT",204,OTHER,INTERVENTIONAL,Allocation: RANDOMIZED|Intervention Model: SINGLE_GROUP|Masking: SINGLE (INVESTIGATOR)|Primary Purpose: TREATMENT,2012-09,"DaySurgical unit Regionshospital Randers, Randers, 8900, Denmark|Regions Hospital Randers, Randers, 8900, Denmark"
NCT04830384,Evaluation of LLLT/Music for Smoking Cessation,https://clinicaltrials.gov/study/NCT04830384,COMPLETED,NO,"Nicotine Dependence, Cigarettes",DEVICE: Fully Active|DEVICE: LLLT Only|DEVICE: Music Only|DEVICE: Placebo,"Freedom Laser, Inc.","NST Consultants, Inc.",ALL,"ADULT, OLDER_ADULT",28,INDUSTRY,INTERVENTIONAL,"Allocation: RANDOMIZED|Intervention Model: FACTORIAL|Masking: QUADRUPLE (PARTICIPANT, CARE_PROVIDER, INVESTIGATOR, OUTCOMES_ASSESSOR)|Primary Purpose: TREATMENT",2020-12-31,"NST Consultants, Inc., Mendham, New Jersey, 07945, United States"
NCT05728398,Music in Interventional Radiology Procedures,https://clinicaltrials.gov/study/NCT05728398,UNKNOWN,NO,Patient Satisfaction,OTHER: Music|OTHER: No Music,"Western University, Canada",,ALL,"ADULT, OLDER_ADULT",60,OTHER,INTERVENTIONAL,Allocation: RANDOMIZED|Intervention Model: PARALLEL|Masking: NONE|Primary Purpose: OTHER,2024-01-31,
NCT02644356,Complementary Therapies in Palliative Care,https://clinicaltrials.gov/study/NCT02644356,COMPLETED,YES,Health Care Provider Education,BEHAVIORAL: Online CE/CME course,"Collinge and Associates, Inc.","Kozak & Associates, LLC",ALL,"ADULT, OLDER_ADULT",51,OTHER,INTERVENTIONAL,Allocation: NA|Intervention Model: SINGLE_GROUP|Masking: NONE|Primary Purpose: OTHER,2013-12,
